degree,formation,speciality,segmentation,
Master,Mention communication publique et politique,,,Master Mention communication publique et politique
Master,Mention Démographie,,,Master Mention Démographie
Master,Mention Histoire,,,Master Mention Histoire
Master,Mention philosophie,,,Master Mention philosophie
Master,Mention Philosophie,,,Master Mention Philosophie
Master,mention Sciences du vivant,,,Master mention Sciences du vivant
Master,Méthodes informatiques appliquées à la gestion des entreprises - MIAGE,,,Master Méthodes informatiques appliquées à la gestion des entreprises - MIAGE
Master,Métiers de l'Enseignement de l'Education et de la Formation (MEEF) pour l'Enseignement Agricole,,,Master Métiers de l'Enseignement de l'Education et de la Formation (MEEF) pour l'Enseignement Agricole
Master,"Métiers de l'enseignement, de l'éducation et de la formation (MEEF)",1er degré,,"Master Métiers de l'enseignement, de l'éducation et de la formation (MEEF) 1er degré"
Master,"Métiers de l'enseignement, de l'éducation et de la formation (MEEF)",2nd degré,,"Master Métiers de l'enseignement, de l'éducation et de la formation (MEEF) 2nd degré"
Master,"Métiers de l’enseignement, de l’éducation et de la formation (MEEF), encadrement éducatif (",,,"Master Métiers de l’enseignement, de l’éducation et de la formation (MEEF), encadrement éducatif ( "
Master,"Métiers de l’enseignement, de l’éducation et de la formation (MEEF), pratiques et ingénierie de la formation ",,,"Master Métiers de l’enseignement, de l’éducation et de la formation (MEEF), pratiques et ingénierie de la formation  "
Master,Métiers des Etudes du Conseil et de l'Intervention,,,Master Métiers des Etudes du Conseil et de l'Intervention
Master,Métiers du livre et de l'édition,,,Master Métiers du livre et de l'édition
Master,Microbiologie,,,Master Microbiologie
Master,Mode,,,Master Mode
Master,Mondes anciens,,,Master Mondes anciens
Master,Mondes médiévaux,,,Master Mondes médiévaux
Master,"Monnaie, Banque, Finance, Assurance ",,,"Master Monnaie, Banque, Finance, Assurance  "
Master,Musicologie,,,Master Musicologie
Master,Nanosciences et nanotechnologies,,,Master Nanosciences et nanotechnologies
Master,Neurosciences,,,Master Neurosciences
Master,Nutrition et Sciences des Aliments,,,Master Nutrition et Sciences des Aliments
Master,Patrimoine et musées,,,Master Patrimoine et musées
Master,Pharmacologie,,,Master Pharmacologie
Master,Physique appliquée et ingénierie physique,,,Master Physique appliquée et ingénierie physique
Master,Physique fondamentale et applications,,,Master Physique fondamentale et applications
Master,Politiques Publiques,,,Master Politiques Publiques
Master,"Pratiques inclusives, handicap, accessibilité et accompagnement ",,,"Master Pratiques inclusives, handicap, accessibilité et accompagnement  "
Master,Psychanalyse,,,Master Psychanalyse
Master,Psychologie : psychopathologie clinique psychanalytique,,,Master Psychologie : psychopathologie clinique psychanalytique
Master,Psychologie,,,Master Psychologie
Master,"Psychologie Clinique, Psychopathologie et Psychologie de la Santé ",,,"Master Psychologie Clinique, Psychopathologie et Psychologie de la Santé  "
Master,Psychologie de l’éducation et de la formation,,,Master Psychologie de l’éducation et de la formation
Master,"Psychologie sociale, du travail et des organisations ",,,"Master Psychologie sociale, du travail et des organisations  "
Master,"Qualité, hygiène, sécurité",,,"Master Qualité, hygiène, sécurité "
Master,Ressources humaines,,,Master  Ressources humaines
Master,Relation internationale,,,Master Relation internationale
Master,Réseaux et télécommunication,,,Master Réseaux et télécommunication
Master,Risques et environnement,,,Master Risques et environnement
Master,Santé,,,Master Santé
Master,Santé publique,,,Master Santé publique
Master,"Science de l’océan, de l’atmosphère et du climat ",,,"Master Science de l’océan, de l’atmosphère et du climat  "
Master,Science de la durabilité,,,Master Science de la durabilité
Master,Science politique,,,Master Science politique
Master,Sciences cognitives,,,Master Sciences cognitives
Master,Sciences de l'information et des bibliothèques,,,Master Sciences de l'information et des bibliothèques
Master,Sciences de l’eau,,,Master Sciences de l’eau
Master,Sciences de l’éducation,,,Master Sciences de l’éducation
Master,Sciences de la matière,,,Master Sciences de la matière
Master,"Sciences de la Terre et des planètes, environnement ",,,"Master Sciences de la Terre et des planètes, environnement  "
Master,Sciences de la vision,,,Master Sciences de la vision
Master,Sciences du bois,,,Master Sciences du bois
Master,Sciences du langage,,,Master Sciences du langage
Master,Sciences du médicament et des produits de santé,,,Master Sciences du médicament et des produits de santé
Master,Sciences du vivant,,,Master Sciences du vivant
Master,Sciences économiques et sociales,,,Master Sciences économiques et sociales
Master,Sciences et cultures du visuel,,,Master Sciences et cultures du visuel
Master,Sciences et génie des matériaux,,,Master Sciences et génie des matériaux
Master,Sciences et numérique pour la santé,,,Master Sciences et numérique pour la santé
Master,"Sciences et technologie de l'agriculture, de l'alimentation et de l'environnement ",,,"Master Sciences et technologie de l'agriculture, de l'alimentation et de l'environnement  "
Master,Sciences humaines et sociales,Humanités et management,,Master Sciences humaines et sociales  Humanités et management
Master,Sciences pour l'environnement,,,Master Sciences pour l'environnement
Master,Sciences sociales,,,Master Sciences sociales
Master,Sciences Technologies Santé,Qualité hygiène sécurité,,Master Sciences Technologies Santé Qualité hygiène sécurité
Master,Sciences technologies santé,"Nutrition, sciences des aliments",,"Master Sciences technologies santé Nutrition, sciences des aliments"
Master,Sciences technologies santé,"Transport, mobilité, réseaux",,"Master Sciences technologies santé Transport, mobilité, réseaux"
Master,"Sciences, Technologies, Santé",Nutrition et sciences des aliments,,"Master Sciences, Technologies, Santé Nutrition et sciences des aliments"
Master,"Sciences, Technologies, Santé ",Physique,,"Master Sciences, Technologies, Santé  Physique"
Master,"Sciences, Technologies, Santé ","Qualité, Hygiène, Sécurité",,"Master Sciences, Technologies, Santé  Qualité, Hygiène, Sécurité"
Master,"Sciences, Technologies, Santé",Nutrition et Sciences des aliments,,"Master Sciences, Technologies, Santé Nutrition et Sciences des aliments"
Master,Sociologie,,,Master Sociologie
Master,STAPS : Activité physique adaptée et santé (APA-S)(fiche nationale),,,Master STAPS : Activité physique adaptée et santé (APA-S)(fiche nationale)
Master,STAPS : Entraînement et optimisation de la performance sportive (fiche nationale),,,Master STAPS : Entraînement et optimisation de la performance sportive (fiche nationale)
Master,STAPS : Ingénierie et ergonomie de l'activité physique (IEAP)(fiche nationale),,,Master STAPS : Ingénierie et ergonomie de l'activité physique (IEAP)(fiche nationale)
Master,STAPS : management du sport (fiche nationale),,,Master STAPS : management du sport (fiche nationale)
Master,Statistique et économie du risque,,,Master Statistique et économie du risque
Master,"Techniques, Patrimoine, Territoires de l'industrie : histoire, valorisation didactique",,,"Master Techniques, Patrimoine, Territoires de l'industrie : histoire, valorisation didactique "
Master,Théâtre,,,Master Théâtre
Master,Tourisme,,,Master Tourisme
Master,Toxicologie et éco-toxicologie,,,Master Toxicologie et éco-toxicologie
Master,"Traduction, interprétation ",,,"Master Traduction, interprétation  "
Master,Traitement du Signal et des Images,,,Master Traitement du Signal et des Images
Master,"Transport, mobilités, réseaux ",,,"Master Transport, mobilités, réseaux  "
Master,Urbanisme et aménagement,,,Master Urbanisme et aménagement
Master,Ville et environnements urbains,,,Master Ville et environnements urbains
BACHELOR,Achat,,,BACHELOR  Achat
BACHELOR,Achat,Supply Chain,,BACHELOR  Achat  Supply Chain
BACHELOR,Administration des entreprises,,,BACHELOR Administration des entreprises
BACHELOR,Aéronautique,,,BACHELOR Aéronautique
BACHELOR,Agricole,,,BACHELOR Agricole
BACHELOR,Agroalimentaire,,,BACHELOR Agroalimentaire
BACHELOR,Agrobusiness,,,BACHELOR Agrobusiness
BACHELOR,Agronomie,,,BACHELOR Agronomie
BACHELOR,Analyse Financiere,,,BACHELOR Analyse Financiere
BACHELOR,Angalis,,,BACHELOR Angalis
BACHELOR,Architecture,Architecture interieur,,BACHELOR Architecture  Architecture interieur
BACHELOR,Architecture,Design d espace,,BACHELOR Architecture  Design d espace
BACHELOR,Art,Médiation culturelle,,BACHELOR Art  Médiation culturelle
BACHELOR,Art,Marché de l art,,BACHELOR Art  Marché de l art
BACHELOR,Art,Design graphique,,BACHELOR Art  Design graphique
BACHELOR,Art,Design de produits,,BACHELOR Art  Design de produits
BACHELOR,Art,Design d' espace,,BACHELOR Art  Design d' espace
BACHELOR,Art,Communication visuelle,,BACHELOR Art  Communication visuelle
BACHELOR,Art appliqué,Design graphique,,BACHELOR Art appliqué  Design graphique
BACHELOR,Art appliqué,Design de produits,,BACHELOR Art appliqué  Design de produits
BACHELOR,Art appliqué,Design d espace,,BACHELOR Art appliqué  Design d espace
BACHELOR,Art appliqué,Communication visuelle,,BACHELOR Art appliqué  Communication visuelle
BACHELOR,Art décoratif,Architecture d interieur,,BACHELOR Art décoratif  Architecture d interieur
BACHELOR,Art décoratif,Décoration d' interieur,,BACHELOR Art décoratif  Décoration d' interieur
BACHELOR,Art Graphique,Animation 3D,,BACHELOR Art Graphique  Animation 3D
BACHELOR,Art Graphique,Design Graphique,,BACHELOR Art Graphique  Design Graphique
BACHELOR,Art textile,Stylisme,,BACHELOR Art textile  Stylisme
BACHELOR,Art numérique,,,BACHELOR Art numérique
BACHELOR,Assurance,,,BACHELOR Assurance
BACHELOR,Assurance,"Banque, Finance ",,"BACHELOR Assurance  Banque, Finance "
BACHELOR,Audio Visuel,MA,,BACHELOR Audio Visuel MA
BACHELOR,Audio Visuel,Son,,BACHELOR Audio Visuel Son
BACHELOR,Audit,CCA,,BACHELOR Audit  CCA
BACHELOR,Banque,"Assurance, banque, finance ",,"BACHELOR Banque  Assurance, banque, finance "
BACHELOR,Banque,Gestion du Patrimoine,,BACHELOR Banque  Gestion du Patrimoine
BACHELOR,Bâtiment et Travaux Publics,,,BACHELOR Bâtiment et Travaux Publics
BACHELOR,Biologie,,,BACHELOR Biologie
BACHELOR,Chimie,,,BACHELOR Chimie
BACHELOR,Chinois,,,BACHELOR Chinois
BACHELOR,Cinéma,,,BACHELOR Cinéma
BACHELOR,Commerce,,,BACHELOR Commerce
BACHELOR,Commerce,BBA,,BACHELOR Commerce  BBA
BACHELOR,Commerce,E -Business,,BACHELOR Commerce  E -Business
BACHELOR,Commerce,E-Commerce,,BACHELOR Commerce  E-Commerce
BACHELOR,Commerce,Ingenieur d' affaire,,BACHELOR Commerce  Ingenieur d' affaire
BACHELOR,Commerce,International Business,,BACHELOR Commerce  International Business
BACHELOR,Commerce,Management international,,BACHELOR Commerce  Management international
BACHELOR,Commerce,Maketing International,,BACHELOR Commerce  Maketing International
BACHELOR,Commerce,Stratégie d' entreprise,,BACHELOR Commerce  Stratégie d' entreprise
BACHELOR,Commerce,TC,,BACHELOR Commerce  TC
BACHELOR,Commerce International,,,BACHELOR Commerce International
BACHELOR,Commerce International,International Business,,BACHELOR Commerce International International Business
BACHELOR,Commerce International,Management international,,BACHELOR Commerce International Management international
BACHELOR,Commerce International,Marketing International,,BACHELOR Commerce International  Marketing International
BACHELOR,Communication,,,BACHELOR Communication
BACHELOR,Communication,Communication digitale.,,BACHELOR Communication Communication digitale.
BACHELOR,Communication,Communication Evénementiel.,,BACHELOR Communication Communication Evénementiel.
BACHELOR,Communication,Communication visuelle.,,BACHELOR Communication Communication visuelle.
BACHELOR,Communication,Community Management.,,BACHELOR Communication Community Management.
BACHELOR,Communication,Web Marketing.,,BACHELOR Communication Web Marketing.
BACHELOR,Communication,Marketing Digital.,,BACHELOR Communication Marketing Digital.
BACHELOR,Comptabilité,,,BACHELOR Comptabilité
BACHELOR,Contôle de gestion,,,BACHELOR Contôle de gestion
BACHELOR,Cosmétique,,,BACHELOR Cosmétique
BACHELOR,Cuisine,Arts culinaires,,BACHELOR Cuisine  Arts culinaires
BACHELOR,Cuisine,Gastronomie,,BACHELOR Cuisine  Gastronomie
BACHELOR,Cuisine,Hotellerie restauration,,BACHELOR Cuisine  Hotellerie restauration
BACHELOR,Cuisine,Management de restaurant,,BACHELOR Cuisine  Management de restaurant
BACHELOR,Culture,,,BACHELOR Culture
BACHELOR,Décoration Interieur,Arts décoratifs,,BACHELOR Décoration Interieur  Arts décoratifs
BACHELOR,Décoration Interieur,Décoration,,BACHELOR Décoration Interieur  Décoration
BACHELOR,Design,Communication digitale,,BACHELOR Design Communication digitale
BACHELOR,Design,Communication visuelle,,BACHELOR Design Communication visuelle
BACHELOR,Design,Marketing Digital,,BACHELOR Design Marketing Digital
BACHELOR,Design,Web Marketing,,BACHELOR Design Web Marketing
BACHELOR,Design,Art,,BACHELOR Design Art
BACHELOR,Design,Art appliqué,,BACHELOR Design Art appliqué
BACHELOR,Design,Art graphique,,BACHELOR Design Art graphique
BACHELOR,Design,Communication,,BACHELOR Design Communication
BACHELOR,Design,Design,,BACHELOR Design Design
BACHELOR,Design,Graphisme,,BACHELOR Design Graphisme
BACHELOR,Design,Pub,,BACHELOR Design Pub
BACHELOR,Développement agricole,,,BACHELOR Développement agricole
BACHELOR,Dévelopement durable,,rse,BACHELOR Dévelopement durable
BACHELOR,Digital,Marketing Digital,,BACHELOR Digital  Marketing Digital
BACHELOR,Digital,Communication digitale,,BACHELOR Digital  Communication digitale
BACHELOR,Digital,Community Management,,BACHELOR Digital  Community Management
BACHELOR,Digital,Digital management,,BACHELOR Digital  Digital management
BACHELOR,Digital,Management de l'innovation,,BACHELOR Digital  Management de l'innovation
BACHELOR,Distribution,,,BACHELOR Distribution
BACHELOR,Droit,,,BACHELOR Droit
BACHELOR,Droit international,,,BACHELOR Droit international
BACHELOR,Droit privé,,,BACHELOR Droit privé
BACHELOR,Droit public,,,BACHELOR Droit public
BACHELOR,Droit social,,,BACHELOR Droit social
BACHELOR,Economie,,,BACHELOR Economie
BACHELOR,Édition,,,BACHELOR Édition
BACHELOR,Effets spéciaux,,,BACHELOR Effets spéciaux
BACHELOR,Electronique,Ingenieur du son,,BACHELOR Electronique  Ingenieur du son
BACHELOR,Electronique,Systémes embarqués,,BACHELOR Electronique  Systémes embarqués
BACHELOR,Energie,,,BACHELOR Energie
BACHELOR,Entreprenariat,,,BACHELOR Entreprenariat
BACHELOR,Environnement,Énergie renouvelable,,BACHELOR Environnement Énergie renouvelable
BACHELOR,Environnement,HSE,,BACHELOR Environnement HSE
BACHELOR,Environnement,Management de l'environnement,,BACHELOR Environnement Management de l'environnement
BACHELOR,Environnement,QSE,,BACHELOR Environnement QSE
BACHELOR,Environnement,Sustainable Development,,BACHELOR Environnement Sustainable Development
BACHELOR,Généraliste,,,BACHELOR Généraliste
BACHELOR,Espagnol,,,BACHELOR Espagnol
BACHELOR,Esthétique,Maquillage,,BACHELOR Esthétique  Maquillage
BACHELOR,Evénementiel,Communication Evénementiel,,BACHELOR Evénementiel Communication Evénementiel
BACHELOR,Evénementiel,Management Evénementiel,,BACHELOR Evénementiel Management Evénementiel
BACHELOR,Finance,Corporate Finance,,BACHELOR Finance Corporate Finance
BACHELOR,Finance,Finance d'entreprise,,BACHELOR Finance Finance d'entreprise
BACHELOR,Finance,Finance des marchés,,BACHELOR Finance Finance des marchés
BACHELOR,Finance,Management financier,,BACHELOR Finance Management financier
BACHELOR,Fiscalité,,,BACHELOR Fiscalité
BACHELOR,Génie civil,,,BACHELOR Génie civil
BACHELOR,Gestion,Assistant de direction,,BACHELOR Gestion Assistant de direction
BACHELOR,Gestion,Gestion de projet,,BACHELOR Gestion Gestion de projet
BACHELOR,Gestion,Gestion des entreprises,,BACHELOR Gestion Gestion des entreprises
BACHELOR,Gestion,GRH,,BACHELOR Gestion GRH
BACHELOR,Gestion,Gestion du patrimoine,,BACHELOR Gestion Gestion du patrimoine
BACHELOR,Gestion,Management et Gestion des PME,,BACHELOR Gestion Management et Gestion des PME
BACHELOR,Gestion,Stratégie d'entreprise,,BACHELOR Gestion Stratégie d'entreprise
BACHELOR,Graphisme,Animation 3D,,BACHELOR Graphisme Animation 3D
BACHELOR,Graphisme,Communication visuelle,,BACHELOR Graphisme Communication visuelle
BACHELOR,Graphisme,Design graphique,,BACHELOR Graphisme Design graphique
BACHELOR,Graphisme,PAO,,BACHELOR Graphisme PAO
BACHELOR,Graphisme,UX Design,,BACHELOR Graphisme UX Design
BACHELOR,Hôtellerie,Gastronomie,,BACHELOR Hôtellerie Gastronomie
BACHELOR,Hôtellerie,Gestion hôtelière,,BACHELOR Hôtellerie Gestion hôtelière
BACHELOR,Hôtellerie,Hospitality management,,BACHELOR Hôtellerie Hospitality management
BACHELOR,Hôtellerie,Management hôtelier,,BACHELOR Hôtellerie Management hôtelier
BACHELOR,Immobilier,,,BACHELOR Immobilier
BACHELOR,Immobilier,Gestion du patrimoine,,BACHELOR Immobilier Gestion du patrimoine
BACHELOR,Industrie,,,BACHELOR Industrie
BACHELOR,Infographie,,,BACHELOR Infographie
BACHELOR,Infographie 3D,,,BACHELOR Infographie 3D
BACHELOR,Informatique,,,BACHELOR Informatique
BACHELOR,Informatique,Web Mobile,,BACHELOR Informatique Web Mobile
BACHELOR,Informatique,Big data,,BACHELOR Informatique Big data
BACHELOR,Informatique,Création de site Internet,,BACHELOR Informatique Création de site Internet
BACHELOR,Informatique,Cybersécurité,,BACHELOR Informatique Cybersécurité
BACHELOR,Informatique,Data science,,BACHELOR Informatique Data science
BACHELOR,Informatique,Développement logiciel,,BACHELOR Informatique Développement logiciel
BACHELOR,Informatique,Domotique,,BACHELOR Informatique Domotique
BACHELOR,Informatique,Intelligence artificielle,,BACHELOR Informatique Intelligence artificielle
BACHELOR,Informatique,Management des SI,,BACHELOR Informatique Management des SI
BACHELOR,Informatique,Protection des données personnelles,,BACHELOR Informatique Protection des données personnelles
BACHELOR,Informatique,Sécurité informatique,,BACHELOR Informatique Sécurité informatique
BACHELOR,Informatique,Systèmes numériques,,BACHELOR Informatique Systèmes numériques
BACHELOR,Ingénieur,Ingénieur d affaires,,BACHELOR Ingénieur Ingénieur d affaires
BACHELOR,Internet,,,BACHELOR Internet
BACHELOR,Internet,Communication digitale,,BACHELOR Internet Communication digitale
BACHELOR,Internet,Community Management,,BACHELOR Internet Community Management
BACHELOR,Internet,Création de site Internet,,BACHELOR Internet Création de site Internet
BACHELOR,Internet,Cybersécurité,,BACHELOR Internet Cybersécurité
BACHELOR,Internet,Digital management,,BACHELOR Internet Digital management
BACHELOR,Internet,e-business,,BACHELOR Internet e-business
BACHELOR,Internet,e-commerce,,BACHELOR Internet e-commerce
BACHELOR,Internet,Marketing Digital,,BACHELOR Internet Marketing Digital
BACHELOR,Internet,Web,,BACHELOR Internet Web
BACHELOR,Internet,Web Marketing,,BACHELOR Internet Web Marketing
BACHELOR,Internet,Web Mobile,,BACHELOR Internet Web Mobile
BACHELOR,Jeux vidéo,Animation 3D,,BACHELOR Jeux vidéo Animation 3D
BACHELOR,Jeux vidéo,Game design,,BACHELOR Jeux vidéo Game design
BACHELOR,Jeux vidéo,eSport,,BACHELOR Jeux vidéo eSport
BACHELOR,Jeux vidéo,Game Art,,BACHELOR Jeux vidéo Game Art
BACHELOR,Journalisme,,,BACHELOR Journalisme
BACHELOR,Juridique,,,BACHELOR Juridique
BACHELOR,Langues étrangères,,,BACHELOR Langues étrangères
BACHELOR,Logistique,Supply chain,,BACHELOR Logistique Supply chain
BACHELOR,Luxe,Joaillerie Bijouterie,,BACHELOR Luxe Joaillerie Bijouterie
BACHELOR,Luxe,Management du luxe,,BACHELOR Luxe Management du luxe
BACHELOR,Luxe,Marketing du Luxe,,BACHELOR Luxe Marketing du Luxe
BACHELOR,Luxe,,,BACHELOR Luxe
BACHELOR,Maintenance - qualité,,,BACHELOR Maintenance - qualité
BACHELOR,Maintenance informatique,,,BACHELOR Maintenance informatique
BACHELOR,Management,,,BACHELOR Management
BACHELOR,Management,Tourisme,,BACHELOR Management  Tourisme
BACHELOR,Management,Luxe,,BACHELOR Management  Luxe
BACHELOR,Management,Assistant de direction,,BACHELOR Management  Assistant de direction
BACHELOR,Management,ARH,,BACHELOR Management  ARH
BACHELOR,Management,Communication Evénementiel,,BACHELOR Management  Communication Evénementiel
BACHELOR,Management,Digital management,,BACHELOR Management  Digital management
BACHELOR,Management,Gestion commerciale,,BACHELOR Management  Gestion commerciale
BACHELOR,Management,Gestion de projet,,BACHELOR Management  Gestion de projet
BACHELOR,Management,Gestion des entreprises,,BACHELOR Management  Gestion des entreprises
BACHELOR,Management,GRH,,BACHELOR Management  GRH
BACHELOR,Management,Gestion du personnel,,BACHELOR Management  Gestion du personnel
BACHELOR,Management,Management de l'environnement,,BACHELOR Management  Management de l'environnement
BACHELOR,Management,Management de l'innovation,,BACHELOR Management  Management de l'innovation
BACHELOR,Management,Management de projet,,BACHELOR Management  Management de projet
BACHELOR,Management,Management de restaurant,,BACHELOR Management  Management de restaurant
BACHELOR,Management,Management des SI,,BACHELOR Management  Management des SI
BACHELOR,Management,Management du sport,,BACHELOR Management  Management du sport
BACHELOR,Management,Management et Gestion des PME,,BACHELOR Management  Management et Gestion des PME
BACHELOR,Management,Management Evénementiel,,BACHELOR Management  Management Evénementiel
BACHELOR,Management,Management financier,,BACHELOR Management  Management financier
BACHELOR,Management,Management hôtelier,,BACHELOR Management  Management hôtelier
BACHELOR,Management,Management international,,BACHELOR Management  Management international
BACHELOR,Management,Marketing sportif,,BACHELOR Management  Marketing sportif
BACHELOR,Management,Sport business,,BACHELOR Management  Sport business
BACHELOR,Management,Stratégie d'entreprise,,BACHELOR Management  Stratégie d'entreprise
BACHELOR,Management,Sustainable Development,,BACHELOR Management  Sustainable Development
BACHELOR,Management,Supply chain,,BACHELOR Management  Supply chain
BACHELOR,Manucure,,,BACHELOR Manucure
BACHELOR,Marketing,,,BACHELOR Marketing
BACHELOR,Marketing,Communication visuelle,marketing,BACHELOR Marketing Communication visuelle
BACHELOR,Marketing,Community Management,,BACHELOR Marketing Community Management
BACHELOR,Marketing,Marketing Digital,,BACHELOR Marketing Marketing Digital
BACHELOR,Marketing,Marketing du Luxe,,BACHELOR Marketing Marketing du Luxe
BACHELOR,Marketing,Marketing International,,BACHELOR Marketing Marketing International
BACHELOR,Marketing,Marketing Opérationnel,,BACHELOR Marketing Marketing Opérationnel
BACHELOR,Marketing,Marketing sportif,,BACHELOR Marketing Marketing sportif
BACHELOR,Marketing,Web Marketing,,BACHELOR Marketing Web Marketing
BACHELOR,Médias,Community Management,,BACHELOR Médias  Community Management
BACHELOR,Métiers du son,,,BACHELOR Métiers du son
BACHELOR,Mode,,,BACHELOR Mode
BACHELOR,Mode,Management de la mode,,BACHELOR Mode Management de la mode
BACHELOR,Mode,Management du luxe,,BACHELOR Mode Management du luxe
BACHELOR,Mode,Merchandising,,BACHELOR Mode Merchandising
BACHELOR,Mode,Modélisme,,BACHELOR Mode Modélisme
BACHELOR,Mode,Stylisme,,BACHELOR Mode Stylisme
BACHELOR,Montage de vidéos,Animation 3D,,BACHELOR Montage de vidéos  Animation 3D
BACHELOR,Motion design,,,BACHELOR Motion design
BACHELOR,Multimédia,Communication digitale,,BACHELOR Multimédia Communication digitale
BACHELOR,Multimédia,MA,,BACHELOR Multimédia MA
BACHELOR,Multimédia,Web,,BACHELOR Multimédia  Web
BACHELOR,Musique,,,BACHELOR Musique
BACHELOR,Négociation,TC,,BACHELOR Négociation  TC
BACHELOR,Notariat,,,BACHELOR Notariat
BACHELOR,Nutrition,Diétetique,,BACHELOR Nutrition Diétetique
BACHELOR,Oenologie,Vin,,BACHELOR Oenologie Vin
BACHELOR,Office management,,,
BACHELOR,Optique,,,BACHELOR Optique
BACHELOR,Paramédical,Diététique,,BACHELOR Paramédical Diététique
BACHELOR,Parfumerie,,,BACHELOR Parfumerie
BACHELOR,Pâtisserie,Arts culinaires,,BACHELOR Pâtisserie  Arts culinaires
BACHELOR,Pâtisserie,Gastronomie,,BACHELOR Pâtisserie  Gastronomie
BACHELOR,Patrimoine culturel,,,BACHELOR Patrimoine culturel
BACHELOR,Photographie,,,BACHELOR Photographie
BACHELOR,Programmation informatique,Développement logiciel,,BACHELOR Programmation informatique Développement logiciel
BACHELOR,Programmation informatique,Web Mobile,,BACHELOR Programmation informatique Web Mobile
BACHELOR,Publicité,Communication digitale,,BACHELOR Publicité  Communication digitale
BACHELOR,Publicité,Communication visuelle,,BACHELOR Publicité  Communication visuelle
BACHELOR,Publicité,Design graphique,,BACHELOR Publicité  Design graphique
BACHELOR,Publicité,Marketing Digital,,BACHELOR Publicité  Marketing Digital
BACHELOR,Publicité,Web Marketing,,BACHELOR Publicité  Web Marketing
BACHELOR,Radio,,,BACHELOR Radio
BACHELOR,Relations Internationales,,,BACHELOR Relations Internationales
BACHELOR,Ressources Humaines,,,BACHELOR Ressources Humaines
BACHELOR,Ressources Humaines,GRH,,BACHELOR Ressources Humaines GRH
BACHELOR,Ressources Humaines,Gestion du personnel,,BACHELOR Ressources Humaines  Gestion du personnel
BACHELOR,Restauration,Gastronomie,,BACHELOR Restauration  Gastronomie
BACHELOR,Restauration,Management de restaurant,,BACHELOR Restauration  Management de restaurant
BACHELOR,Restauration,Vin,,BACHELOR Restauration  Vin
BACHELOR,Robotique,Intelligence artificielle,,BACHELOR Robotique Intelligence artificielle
