degree,formation,speciality,segmentation,
CAP,Rentrayeur,Tapis,,CAP Rentrayeur Tapis
CAP,Etancheur du bâtiment et des travaux publics,,,CAP Etancheur du bâtiment et des travaux publics
CAP,Agent de prévention et de médiation,,,CAP Agent de prévention et de médiation
CAP,Chaussure,,,CAP Chaussure
CAP,"Composites, plastiques chaudronnés",,,"CAP Composites, plastiques chaudronnés "
CAP,Vannerie,,,CAP Vannerie
CAP,Transport fluvial,,,CAP Transport fluvial
CAP,"métiers de la mode, vêtement flou",,,"CAP métiers de la mode, vêtement flou "
CAP,"métiers de la mode, vêtement tailleur",,,"CAP métiers de la mode, vêtement tailleur "
CAP,Conducteur d'installations de production,,,CAP Conducteur d'installations de production
CAP,marbrier du bâtiment et de la décoration,,,CAP marbrier du bâtiment et de la décoration
CAP,Tailleur de pierre,,,CAP Tailleur de pierre
CAP,Conducteur livreur de marchandises,,,CAP Conducteur livreur de marchandises
CAP,aéronautique,avionique,,CAP aéronautique avionique
CAP,aéronautique,structure,,CAP aéronautique structure
CAP,aéronautique,système,,CAP aéronautique système
CAP,Agent de sécurité,,,CAP Agent de sécurité
CAP,Boulanger,,,CAP Boulanger
CAP,Maintenance de véhicules,voitures particulières,,CAP Maintenance de véhicules voitures particulières
CAP,Maintenance de véhicules,véhicules de transport routier,,CAP Maintenance de véhicules véhicules de transport routier
CAP,Maintenance de véhicules,Motocycles,,CAP Maintenance de véhicules Motocycles
CAP,Sellier harnacheur,,,CAP Sellier harnacheur
CAP,Opérateur/opératrice logistique,,,CAP Opérateur/opératrice logistique
CAP,propreté de l'environnement urbain,collecte et recyclage,,CAP propreté de l'environnement urbain collecte et recyclage
CAP,Ferronnier d'art,,,CAP Ferronnier d'art
CAP,Agent de propreté et d'hygiène,,,CAP Agent de propreté et d'hygiène
CAP,Métiers de la mode,chapelier modiste,,CAP Métiers de la mode chapelier modiste
CAP,Cuisine,,,CAP Cuisine
CAP,agent d'accueil et de conduite routière,transport de voyageurs,,CAP agent d'accueil et de conduite routière transport de voyageurs
CAP,Réalisations industrielles en chaudronnerie ou soudage,chaudronnerie,,CAP Réalisations industrielles en chaudronnerie ou soudage chaudronnerie
CAP,Réalisations industrielles en chaudronnerie ou soudage,soudage,,CAP Réalisations industrielles en chaudronnerie ou soudage soudage
CAP,Conducteur Opérateur de scierie,,,CAP Conducteur Opérateur de scierie
CAP,Accompagnant éducatif petite enfance,,,CAP Accompagnant éducatif petite enfance
CAP,assistant(e) technique en milieu familial et collectif,,,CAP assistant(e) technique en milieu familial et collectif
CAP,Ebéniste,,,CAP Ebéniste
CAP,Signalétique et décors graphiques,,,CAP Signalétique et décors graphiques
CAP,Charpentier de marine,,,CAP Charpentier de marine
CAP,Maritime de Matelot,,,CAP Maritime de Matelot
CAP,Maritime de Conchyliculture,,,CAP Maritime de Conchyliculture
CAP,Crémier fromager,,,CAP Crémier fromager
CAP,Primeur,,,CAP Primeur
CAP,Opérateur/Opératrice de service,Relation client et livraison,,CAP Opérateur/Opératrice de service Relation client et livraison
CAP,Maintenance des matériels,Matériels d'espaces verts,,CAP Maintenance des matériels Matériels d'espaces verts
CAP,Maintenance des matériels,Matériels de construction et de manutention,,CAP Maintenance des matériels Matériels de construction et de manutention
CAP,Maintenance des matériels,Matériels agricoles,,CAP Maintenance des matériels Matériels agricoles
CAP,Electricien,,,CAP Electricien
CAP,monteur en installations thermiques,,,CAP monteur en installations thermiques
CAP,Monteur en installations sanitaires,,,CAP Monteur en installations sanitaires
CAP,Esthétique Cosmétique Parfumerie,,,CAP Esthétique Cosmétique Parfumerie
CAP,Commercialisation et services hôtel,café-restaurant,,CAP Commercialisation et services hôtel café-restaurant
CAP,Cordonnerie multiservice,,,CAP Cordonnerie multiservice
CAP,Fleuriste,,,CAP Fleuriste
CAP,Installateur en froid et conditionnement d'air,,,CAP Installateur en froid et conditionnement d'air
CAP,Déménageur sur véhicule utilitaire léger,,,CAP Déménageur sur véhicule utilitaire léger
CAP,Art et techniques de la bijouterie-joaillerie,Bijouterie-sertissage,,CAP Art et techniques de la bijouterie-joaillerie Bijouterie-sertissage
CAP,Art et techniques de la bijouterie-joaillerie,Polissage-finition,,CAP Art et techniques de la bijouterie-joaillerie Polissage-finition
CAP,Arts de la reliure,,,CAP Arts de la reliure
CAP,Certificat d’aptitude professionnelle maritime,,,CAP Certificat d’aptitude professionnelle maritime
CAP,Métiers de la coiffure,,,CAP Métiers de la coiffure
CAP,Taxidermiste,,,CAP Taxidermiste
CAP,Constructeur d'ouvrages en béton armé,,,CAP Constructeur d'ouvrages en béton armé
CAP,Equipier polyvalent du commerce,,,CAP Equipier polyvalent du commerce
CAP,Charpentier bois,,,CAP Charpentier bois
CAP,Peintre applicateur de revêtements,,,CAP Peintre applicateur de revêtements
CAP,Pâtissier,,,CAP Pâtissier
CAP,"Production et service en restaurations (rapide, collective, cafétéria)",,,"CAP Production et service en restaurations (rapide, collective, cafétéria) "
CAP,Métiers du plâtre et de l'isolation,,,CAP Métiers du plâtre et de l'isolation
CAP,Constructeur de réseaux de canalisations de travaux publics,,,CAP Constructeur de réseaux de canalisations de travaux publics
CAP,Carreleur Mosaïste,,,CAP Carreleur Mosaïste
CAP,"Arts de la dentelle, options fuseaux et aiguille",,,"CAP Arts de la dentelle, options fuseaux et aiguille "
CAP,Interventions en maintenance technique des bâtiments,,,CAP Interventions en maintenance technique des bâtiments
CAP,Assistant luthier du quatuor,,,CAP Assistant luthier du quatuor
CAP,Métallier,,,CAP Métallier
CAP,Maçon,,,CAP Maçon
CAP,Métiers de l'entretien des textiles,Blanchisserie,,CAP Métiers de l'entretien des textiles  Blanchisserie
CAP,Métiers de l’entretien des textiles,Pressing,,CAP Métiers de l’entretien des textiles Pressing
CAP,Constructeur de routes et d'aménagements urbains,,,CAP Constructeur de routes et d'aménagements urbains
CAP,Couvreur,,,CAP Couvreur
CAP,Menuisier installateur,,,CAP Menuisier installateur
CAP,Conducteur d'engins,Travaux publics et carrières,,CAP Conducteur d'engins Travaux publics et carrières
CAP,Vêtement de Peau,,,CAP Vêtement de Peau
CAP,Métiers de la fonderie,,,CAP Métiers de la fonderie
CAP,Constructeur bois,,,CAP Constructeur bois
CAP,"Menuisier Fabricant de Menuiserie, Mobilier et Agencement",,,"CAP Menuisier Fabricant de Menuiserie, Mobilier et Agencement "
CAP,Peinture en carrosserie,,,CAP Peinture en carrosserie
CAP,Réparation des carrosseries,,,CAP Réparation des carrosseries
CAP,Construction des carrosseries,,,CAP Construction des carrosseries
CAP,Réparation entretien des embarcations de plaisance,,,CAP Réparation entretien des embarcations de plaisance
CAP,Accessoiriste-réalisateur,,,CAP Accessoiriste-réalisateur
CAP,Accordeur de piano,,,CAP Accordeur de piano
CAP,Agent d'assainissement et de collecte des déchets liquides spéciaux,,,CAP Agent d'assainissement et de collecte des déchets liquides spéciaux
CAP,Agent de maintenance des industries de matériaux de construction et connexes,,,CAP Agent de maintenance des industries de matériaux de construction et connexes
CAP,Agent de la qualité de l'eau,,,CAP Agent de la qualité de l'eau
CAP,Agent vérificateur d'appareils extincteurs,,,CAP Agent vérificateur d'appareils extincteurs
CAP,Armurerie (fabrication et réparation),,,CAP Armurerie (fabrication et réparation)
CAP,Arts de la broderie,,,CAP Arts de la broderie
CAP,Arts du bois,Sculpteur ornementiste,,CAP Arts du bois Sculpteur ornementiste
CAP,Arts du bois,Tourneur,,CAP Arts du bois Tourneur
CAP,Arts du bois,Marqueteur,,CAP Arts du bois Marqueteur
CAP,Arts du tapis et de la tapisserie de lisse,,,CAP Arts du tapis et de la tapisserie de lisse
CAP,Arts et techniques du verre,Décorateur sur verre,,CAP Arts et techniques du verre Décorateur sur verre
CAP,Poissonnier,,,CAP Poissonnier
CAP,Arts et technique du verre,Vitrailliste,,CAP Arts et technique du verre Vitrailliste
CAP,Bronzier,Monteur en bronze,,CAP Bronzier Monteur en bronze
CAP,Bronzier,Ciseleur sur bronze,,CAP Bronzier Ciseleur sur bronze
CAP,Bronzier,Tourneur sur bronze,,CAP Bronzier Tourneur sur bronze
CAP,Cannage et paillage en ameublement,,,CAP Cannage et paillage en ameublement
CAP,Horlogerie,,,CAP Horlogerie
CAP,Conducteur routier marchandises,,,CAP Conducteur routier marchandises
CAP,Charcutier traiteur,,,CAP Charcutier traiteur
CAP,Cordonnier bottier,,,CAP Cordonnier bottier
CAP,Décolletage,Opérateur régleur en décolletage,,CAP Décolletage Opérateur régleur en décolletage
CAP,Décoration en céramique,,,CAP Décoration en céramique
CAP,Doreur feuille ornemaniste,,,CAP Doreur feuille ornemaniste
CAP,Art et techniques de la bijouterie-joaillerie,Bijouterie-joaillerie,,CAP Art et techniques de la bijouterie-joaillerie Bijouterie-joaillerie
CAP,Emailleur d'art sur métaux,,,CAP Emailleur d'art sur métaux
CAP,Emballeur professionnel,,,CAP Emballeur professionnel
CAP,Employé technique de laboratoire,,,CAP Employé technique de laboratoire
CAP,Encadreur,,,CAP Encadreur
CAP,Métiers de l'enseigne et de la signalétique,,,CAP Métiers de l'enseigne et de la signalétique
CAP,Fabrication industrielle des céramiques,,,CAP Fabrication industrielle des céramiques
CAP,Fourrure,,,CAP Fourrure
CAP,Gardien d'immeubles,,,CAP Gardien d'immeubles
CAP,Glacier fabricant,,,CAP Glacier fabricant
CAP,Industries chimiques,,,CAP Industries chimiques
CAP,Instruments coupants et de chirurgie,,,CAP Instruments coupants et de chirurgie
CAP,Lapidaire,Diamant,,CAP Lapidaire Diamant
CAP,Lapidaire,Pierres de couleur,,CAP Lapidaire Pierres de couleur
CAP,Mareyage,,,CAP Mareyage
CAP,Maroquinerie,,,CAP Maroquinerie
CAP,Mécanicien conducteur des scieries et des industries mécanique du bois,"Mécanicien affûteur de sciage, tranchage, déroulage",,"CAP Mécanicien conducteur des scieries et des industries mécanique du bois Mécanicien affûteur de sciage, tranchage, déroulage"
CAP,Menuiserie en sièges,,,CAP Menuiserie en sièges
CAP,Métiers du football,,,CAP Métiers du football
CAP,Métiers de la gravure,Gravure d'ornementation,,CAP Métiers de la gravure Gravure d'ornementation
CAP,Métiers de la gravure,Gravure d'impression,,CAP Métiers de la gravure Gravure d'impression
CAP,Métiers de la gravure,Gravure en modele,,CAP Métiers de la gravure Gravure en modele
CAP,Métiers de la gravure,Marquage poinçonnage,,CAP Métiers de la gravure Marquage poinçonnage
CAP,Mise en oeuvre des caoutchoucs et des élastomères thermoplastiques,,,CAP Mise en oeuvre des caoutchoucs et des élastomères thermoplastiques
CAP,Modèles et moules céramiques,,,CAP Modèles et moules céramiques
CAP,Monteur en chapiteaux,,,CAP Monteur en chapiteaux
CAP,Monteur en isolation thermique acoustique,,,CAP Monteur en isolation thermique acoustique
CAP,Monteur de structures mobiles,,,CAP Monteur de structures mobiles
CAP,Mouleur noyauteur : cuivre et bronze,,,CAP Mouleur noyauteur : cuivre et bronze
CAP,Orfèvre,Monteur en orfèvrerie,,CAP Orfèvre Monteur en orfèvrerie
CAP,Orfèvre,Polisseur aviveur en orfèvrerie,,CAP Orfèvre Polisseur aviveur en orfèvrerie
CAP,Orfèvre,Tourneur repousseur en orfèvrerie,,CAP Orfèvre Tourneur repousseur en orfèvrerie
CAP,Orfèvre,Planeur en orfèvrerie,,CAP Orfèvre Planeur en orfèvrerie
CAP,Orthoprothésiste,,,CAP Orthoprothésiste
CAP,Outillage en moules métalliques,,,CAP Outillage en moules métalliques
CAP,Outillages en outils à découper et à emboutir,,,CAP Outillages en outils à découper et à emboutir
CAP,Ouvrier archetier,,,CAP Ouvrier archetier
CAP,Podo-orthésiste,,,CAP Podo-orthésiste
CAP,Mise en forme des matériaux,,,CAP Mise en forme des matériaux
CAP,Arts du Verre et du Cristal,,,CAP Arts du Verre et du Cristal
CAP,Souffleur de Verre,Verrerie scientifique,,CAP Souffleur de Verre Verrerie scientifique
CAP,Sellerie générale,,,CAP Sellerie générale
CAP,Sérigraphie industrielle,,,CAP Sérigraphie industrielle
CAP,Staffeur Ornemaniste,,,CAP Staffeur Ornemaniste
CAP,Tapissier-tapissière d'ameublement en décor,,,CAP Tapissier-tapissière d'ameublement en décor
CAP,Tapissier-tapissière d'ameublement en siège,,,CAP Tapissier-tapissière d'ameublement en siège
CAP,Tonnellerie,,,CAP Tonnellerie
CAP,Tournage céramique,,,CAP Tournage céramique
CAP,Transports par câbles et remontées mécaniques,,,CAP Transports par câbles et remontées mécaniques
CAP,Boucher,,,CAP Boucher
CAP,Rentrayeur,Tapisseries,,CAP Rentrayeur Tapisseries
CAP,Souffleur de Verre,Enseigne lumineuse,,CAP Souffleur de Verre Enseigne lumineuse
CAP,Plasturgie,,,CAP Plasturgie
CAP,Menuisier aluminium-verre,,,CAP Menuisier aluminium-verre
CAP,Assistant technique en instruments de musique,Piano,,CAP Assistant technique en instruments de musique Piano
CAP,Assistant technique en instruments de musique,Guitare,,CAP Assistant technique en instruments de musique Guitare
CAP,Assistant technique en instruments de musique,Instruments à vent,,CAP Assistant technique en instruments de musique Instruments à vent
CAP,Assistant technique en instruments de musique,Accordéon,,CAP Assistant technique en instruments de musique Accordéon
CAP,Chocolatier confiseur,,,CAP Chocolatier confiseur
BP,Mise en oeuvre caoutchoucs élastomères thermoplastiques,,,BP Mise en oeuvre caoutchoucs élastomères thermoplastiques
BP,Pilote d'installations de production par procédés,,,BP Pilote d'installations de production par procédés
BP,Plastiques et composites,,,BP Plastiques et composites
BP,Préparateur en pharmacie,,,BP Préparateur en pharmacie
BP,Sommelier,,,BP Sommelier
BP,Techniques de laboratoire de recherche,Physicochimie,,BP Techniques de laboratoire de recherche Physicochimie
BP,Vêtement sur mesure,Couture flou,,BP Vêtement sur mesure Couture flou
BP,Vêtement sur mesure,Tailleur dame,,BP Vêtement sur mesure Tailleur dame
BP,Vêtement sur mesure création,Tailleur homme,,BP Vêtement sur mesure création Tailleur homme
BP,Technique de laboratoire de recherche,Biologie,,BP Technique de laboratoire de recherche Biologie
BP,Coiffure,,,BP Coiffure
BP,Boulanger,,,BP Boulanger
BP,responsable d'entreprise hippique,,,BP responsable d'entreprise hippique
BP,"Agroéquipement, conduite et maintenance des matériels",,,"BP Agroéquipement, conduite et maintenance des matériels "
BP,Industries alimentaires,,,BP Industries alimentaires
BP,Responsable de chantiers forestiers,,,BP Responsable de chantiers forestiers
BP,Menuisier,,,BP Menuisier
BP,option Responsable d’exploitation aquacole maritime-continentale,,,BP option Responsable d’exploitation aquacole maritime-continentale
BP,"de la jeunesse, de l'éducation populaire et du sport  ",Activités nautiques,,"BP de la jeunesse, de l'éducation populaire et du sport   Activités nautiques "
BP,"de la jeunesse, de l'éducation populaire et du sport - spécialité Techniques de l'information et de la communication",,,"BP de la jeunesse, de l'éducation populaire et du sport - spécialité Techniques de l'information et de la communication "
BP,"de la jeunesse, de l'éducation populaire et du sport, spécialité ""Rugby à XV""",,,"BP de la jeunesse, de l'éducation populaire et du sport, spécialité ""Rugby à XV"" "
BP,Arts du service et commercialisation en restauration,,,BP Arts du service et commercialisation en restauration
BP,Boucher,,,BP Boucher
BP,Electricien(ne),,,BP Electricien(ne)
BP,"Brevet Professionnel de la Jeunesse, de l'Éducation Populaire et du Sport ",Animateur,,"BP Brevet Professionnel de la Jeunesse, de l'Éducation Populaire et du Sport  Animateur "
BP,"Brevet Professionnel de la Jeunesse, de l'Éducation Populaire et du Sport  Sportif ", Educateur sportif,,"BP Brevet Professionnel de la Jeunesse, de l'Éducation Populaire et du Sport  Sportif   Educateur sportif "
BP,Responsable d'entreprise agricole,,,BP Responsable d'entreprise agricole
BP,Installateur dépanneur en froid et conditionnement d'air,,,BP Installateur dépanneur en froid et conditionnement d'air
BP,Etanchéité du bâtiment et des travaux publics,,,BP Etanchéité du bâtiment et des travaux publics
BP,Maçon,,,BP Maçon
BP,Métiers de la piscine,,,BP Métiers de la piscine
BP,Carreleur Mosaïste,,,BP Carreleur Mosaïste
BP,Menuisier aluminium-verre,,,BP Menuisier aluminium-verre
BP,Métiers de la pierre,,,BP Métiers de la pierre
BP,Métallier,,,BP Métallier
BP,Peintre applicateur de revêtements,,,BP Peintre applicateur de revêtements
BP,Métiers du plâtre et de l'isolation,,,BP Métiers du plâtre et de l'isolation
BP,Couvreur,,,BP Couvreur
BP,Conducteur d'engins : travaux publics et carrières,,,BP Conducteur d'engins : travaux publics et carrières
BP,Monteur en installations de génie climatique et sanitaire,,,BP Monteur en installations de génie climatique et sanitaire
BP,Technicien animalier en unité d'expérimentation,,,BP Technicien animalier en unité d'expérimentation
BP,Aménagements paysagers,,,BP Aménagements paysagers
BP,Esthétique Cosmétique Parfumerie,,,BP Esthétique Cosmétique Parfumerie
BP,"Responsable de productions légumières, fruitières, florales et de pépinières",,,"BP Responsable de productions légumières, fruitières, florales et de pépinières "
BP,Arts de la cuisine,,,BP Arts de la cuisine
BP,"Brevet professionnel de la jeunesse, de l’éducation populaire et du sport spécialité « éducateur sportif »              mention parachutisme",,,"BP Brevet professionnel de la jeunesse, de l’éducation populaire et du sport spécialité « éducateur sportif »              mention parachutisme "
BP,"Brevet professionnel de la jeunesse, de l’éducation populaire et du sport spécialité « éducateur sportif »              mention sport automobile",,,"BP Brevet professionnel de la jeunesse, de l’éducation populaire et du sport spécialité « éducateur sportif »              mention sport automobile "
BP,Fleuriste,,,BP Fleuriste
BP, Educateur canin,,,BP  Educateur canin
BP,Conducteur d'appareils des industries chimiques,,,BP Conducteur d'appareils des industries chimiques
BP,"de la jeunesse, de l'éducation populaire et du sport - spécialité Activités sports collectifs",,,"BP de la jeunesse, de l'éducation populaire et du sport - spécialité Activités sports collectifs "
BP,Charpentier de marine,,,BP Charpentier de marine
BP,"Brevet professionel de la jeunesse, de l'éducation populaire et du sport -                                          spécialité Activités de randonnées",Activité de randonnée,,"BP Brevet professionel de la jeunesse, de l'éducation populaire et du sport -                                          spécialité Activités de randonnées Activité de randonnée "
BP,Libraire,,,BP Libraire
BP,Administration des fonctions publiques,,,BP Administration des fonctions publiques
BP,Agent technique de sécurité dans les transports,,,BP Agent technique de sécurité dans les transports
BP,Agent technique de prévention et de sécurité,,,BP Agent technique de prévention et de sécurité
BP,"Ameublement, tapisserie, décoration",,,"BP Ameublement, tapisserie, décoration "
BP,Banque,,,BP Banque
BP,Barman,,,BP Barman
BP,Bureautique,,,BP Bureautique
BP,Charcutier - Traiteur,,,BP Charcutier - Traiteur
BP,Gemmologue,,,BP Gemmologue
BP,Gouvernante,,,BP Gouvernante
BAC PRO,Perruquier Posticheur,,,BAC PRO Perruquier Posticheur
BAC PRO,Logistique,,,BAC PRO Logistique
BAC PRO,Étude et réalisation d'agencement,,,BAC PRO Étude et réalisation d'agencement
BAC PRO,Artisanat et métiers d'art,Verrerie scientifique et technique,,BAC PRO Artisanat et métiers d'art Verrerie scientifique et technique
BAC PRO,Artisanat et métiers d'art,Tapisserie d'ameublement,,BAC PRO Artisanat et métiers d'art Tapisserie d'ameublement
BAC PRO,Artisanat et métiers d'art,Métiers de l enseigne et de la signalétique,,BAC PRO Artisanat et métiers d'art Métiers de l enseigne et de la signalétique
BAC PRO,Artisanat et métiers d'art,Communication Visuelle pluri média,,BAC PRO Artisanat et métiers d'art Communication Visuelle pluri média
BAC PRO,"Façonnage de produits imprimés, routage",,,"BAC PRO Façonnage de produits imprimés, routage "
BAC PRO,"Accompagnement, soins et services à la personne ",A domicile,,"BAC PRO Accompagnement, soins et services à la personne  A domicile"
BAC PRO,"Accompagnement, soins et services à la personne ",En structure,,"BAC PRO Accompagnement, soins et services à la personne  En structure"
BAC PRO,Cuisine,,,BAC PRO Cuisine
BAC PRO,Commercialisation et services en restauration,,,BAC PRO Commercialisation et services en restauration
BAC PRO,Agroéquipement,,,BAC PRO Agroéquipement
BAC PRO,Forêt,,,BAC PRO Forêt
BAC PRO,Gestion des milieux naturels et de la faune,,,BAC PRO Gestion des milieux naturels et de la faune
BAC PRO,Laboratoire contrôle qualité,,,BAC PRO Laboratoire contrôle qualité
BAC PRO,Productions aquacoles,,,BAC PRO Productions aquacoles
BAC PRO,Technicien en expérimentation animale,,,BAC PRO Technicien en expérimentation animale
BAC PRO,Services aux personnes et aux territoires,,,BAC PRO Services aux personnes et aux territoires
BAC PRO,Photographie,,,BAC PRO Photographie
BAC PRO,Technicien Conseil-Vente en Animalerie,,,BAC PRO Technicien Conseil-Vente en Animalerie
BAC PRO,Conduite et gestion de l'entreprise hippique,,,BAC PRO Conduite et gestion de l'entreprise hippique
BAC PRO,Conduite et gestion d'une entreprise du secteur canin et félin,,,BAC PRO Conduite et gestion d'une entreprise du secteur canin et félin
BAC PRO,Pilote de ligne de production,,,BAC PRO Pilote de ligne de production
BAC PRO,"hygiène, propreté, stérilisation",,,"BAC PRO hygiène, propreté, stérilisation "
BAC PRO,gestion des pollutions et protection de l'environnement,,,BAC PRO gestion des pollutions et protection de l'environnement
BAC PRO,"procédés de la chimie, de l'eau et des papiers-cartons",,,"BAC PRO procédés de la chimie, de l'eau et des papiers-cartons "
BAC PRO,Construction des carrosseries,,,BAC PRO Construction des carrosseries
BAC PRO,Conducteur transport routier marchandises,,,BAC PRO Conducteur transport routier marchandises
BAC PRO,Transport fluvial,,,BAC PRO Transport fluvial
BAC PRO,Aeronautique,,,BAC PRO Aeronautique
BAC PRO,aéronautique,Systèmes,,BAC PRO aéronautique  Systèmes
BAC PRO,aéronautique,Avionique,,BAC PRO aéronautique  Avionique
BAC PRO,aéronautique,Structure,,BAC PRO aéronautique  Structure
BAC PRO,aviation générale,,,BAC PRO aviation générale
BAC PRO,Réalisation de produits imprimés et plurimédia,Productions imprimées,,BAC PRO Réalisation de produits imprimés et plurimédia  Productions imprimées
BAC PRO,Réalisation de produits imprimés et plurimédia,Productions graphiques,,BAC PRO Réalisation de produits imprimés et plurimédia  Productions graphiques
BAC PRO,Métiers de la sécurité,,,BAC PRO Métiers de la sécurité
BAC PRO,Maintenance des véhicules,Voitures particulières,,BAC PRO Maintenance des véhicules  Voitures particulières
BAC PRO,Maintenance des véhicules,Véhicules de transport,,BAC PRO Maintenance des véhicules Véhicules de transport
BAC PRO,Maintenance des véhicules,Motocycles,,BAC PRO Maintenance des véhicules  Motocycles
BAC PRO,Techniques d'interventions sur les installations nucléaires,,,BAC PRO Techniques d'interventions sur les installations nucléaires
BAC PRO,technicien en appareillage orthopédique,,,BAC PRO technicien en appareillage orthopédique
BAC PRO,Métiers de la mode - vêtements,,,BAC PRO Métiers de la mode - vêtements
BAC PRO,Métiers du cuir - chaussures,,,BAC PRO Métiers du cuir - chaussures
BAC PRO,Métiers du cuir - maroquinerie,,,BAC PRO Métiers du cuir - maroquinerie
BAC PRO,Métiers de l'Électricité et de ses Environnements Connectés,,,BAC PRO Métiers de l'Électricité et de ses Environnements Connectés
BAC PRO,"Systèmes numériques                                                                                                                                      sûreté et sécurité des infrastructures, de l'habitat et du tertiaire (SSIHT)",,,"BAC PRO Systèmes numériques                                                                                                                                      sûreté et sécurité des infrastructures, de l'habitat et du tertiaire (SSIHT) "
BAC PRO,"Systèmes numériques                                                                                                                                      sûreté et sécurité des infrastructures, de l'habitat et du tertiaire (SSIHT)","Audiovisuels, réseau et équipements domestiques (ARED)",,"BAC PRO Systèmes numériques                                                                                                                                      sûreté et sécurité des infrastructures, de l'habitat et du tertiaire (SSIHT) Audiovisuels, réseau et équipements domestiques (ARED)"
BAC PRO,"Systèmes numériques                                                                                                                                      sûreté et sécurité des infrastructures, de l'habitat et du tertiaire (SSIHT)",Réseaux informatiques et systèmes communicants (RISC),,"BAC PRO Systèmes numériques                                                                                                                                      sûreté et sécurité des infrastructures, de l'habitat et du tertiaire (SSIHT) Réseaux informatiques et systèmes communicants (RISC)"
BAC PRO,Microtechniques,,,BAC PRO Microtechniques
