degree,formation,speciality,segmentation,
BUT,Gestion administrative et commerciale des organisations,"Management des activités culturelles, artistiques, sportives et de tourisme",,"BUT Gestion administrative et commerciale des organisations  Management des activités culturelles, artistiques, sportives et de tourisme"
BUT,Management de la logistique et des transports,Mobilité et supply chain connectées,,BUT Management de la logistique et des transports Mobilité et supply chain connectées
BUT,Management de la logistique et des transports,Mobilité et supply chain durables,,BUT Management de la logistique et des transports  Mobilité et supply chain durables
BUT,Statistique et informatique décisionnelle : Sciences des données,exploration et modélisation statistique,Développement informatique,BUT Statistique et informatique décisionnelle : Sciences des données  exploration et modélisation statistique
BUT,Statistique et informatique décisionnelle : Science des données,"visualisation, conception d'outils décisionnels",,"BUT Statistique et informatique décisionnelle : Science des données  visualisation, conception d'outils décisionnels"
BUT,Science et génie des matériaux,Métiers du recyclage et de la valorisation des matériaux et des produits,,BUT Science et génie des matériaux  Métiers du recyclage et de la valorisation des matériaux et des produits
BUT,Science et génie des matériaux,Métiers de l’ingénierie des matériaux et des produits,,BUT Science et génie des matériaux  Métiers de l’ingénierie des matériaux et des produits
BUT,Science et génie des matériaux,Métiers de la caractérisation et de l’expertise des matériaux et des produits,,BUT Science et génie des matériaux  Métiers de la caractérisation et de l’expertise des matériaux et des produits
BUT,Hygiène Sécurité Environnement,"Science du danger et management des risques professionnels, technologiques et environnementaux",,"BUT Hygiène Sécurité Environnement  Science du danger et management des risques professionnels, technologiques et environnementaux"
BUT,Génie Électrique et Informatique Industrielle,Électricité et Maîtrise de l'Énergie,,BUT Génie Électrique et Informatique Industrielle  Électricité et Maîtrise de l'Énergie
BUT,Génie Électrique et Informatique Industrielle,Automatisme et Informatique Industrielle,,BUT Génie Électrique et Informatique Industrielle  Automatisme et Informatique Industrielle
BUT,Génie Électrique et Informatique Industrielle,Électronique et Systèmes Embarqués,,BUT Génie Électrique et Informatique Industrielle  Électronique et Systèmes Embarqués
BUT,Réseaux & Télécommunications,Cybersécurité,,BUT Réseaux & Télécommunications  Cybersécurité
BUT,Réseaux & Télécommunications,Réseaux Opérateurs et Multimédia,,BUT Réseaux & Télécommunications  Réseaux Opérateurs et Multimédia
BUT,Réseaux & Télécommunications,Internet des objets et mobilité,,BUT Réseaux & Télécommunications  Internet des objets et mobilité
BUT,Réseaux & Télécommunications,Pilotage de projets de réseaux,,BUT Réseaux & Télécommunications  Pilotage de projets de réseaux
BUT,Génie Mécanique et productique,Innovation pour l'industrie,,BUT Génie Mécanique et productique  Innovation pour l'industrie
BUT,Génie Mécanique et Productique,Chargé d'affaires industrielles,,BUT Génie Mécanique et Productique  Chargé d'affaires industrielles
BUT,Génie Mécanique et Productique,Management de process industriel,,BUT Génie Mécanique et Productique  Management de process industriel
BUT,Génie Mécanique et productique,Simulation numérique et réalité virtuelle,,BUT Génie Mécanique et productique  Simulation numérique et réalité virtuelle
BUT,Génie Mécanique et Productique,Conception et production durables,,BUT Génie Mécanique et Productique  Conception et production durables
BUT,Informatique,,Développement informatique,
BUT,Informatique,"Réalisation d'applications : conception, développement, validation",Développement informatique,"BUT Informatique  Réalisation d'applications : conception, développement, validation"
BUT,Informatique,Déploiement d'applications communicantes et sécurisées,Développement informatique,BUT Informatique  Déploiement d'applications communicantes et sécurisées
BUT,Informatique,"Administration, gestion et exploitation des données",,"BUT Informatique  Administration, gestion et exploitation des données"
BUT,Informatique,Intégration d'applications et management du système d'information,,BUT Informatique  Intégration d'applications et management du système d'information
BUT,Mesures Physiques,Techniques d'instrumentation,,BUT Mesures Physiques  Techniques d'instrumentation
BUT,Mesures Physiques,Matériaux et Contrôles Physico-Chimiques,,BUT Mesures Physiques  Matériaux et Contrôles Physico-Chimiques
BUT,Mesures Physiques,Mesures et Analyses Environnementales,,BUT Mesures Physiques  Mesures et Analyses Environnementales
BUT,Génie Civil - Construction Durable,Travaux Bâtiment,,BUT Génie Civil - Construction Durable  Travaux Bâtiment
BUT,Génie Civil - Construction Durable,Travaux Publics,,BUT Génie Civil - Construction Durable  Travaux Publics
BUT,Génie Civil – Construction Durable,Réhabilitation et Amélioration des Performances Environnementales des Bâtiments,,BUT Génie Civil – Construction Durable  Réhabilitation et Amélioration des Performances Environnementales des Bâtiments
BUT,Génie Civil – Construction Durable,Bureau d’Etudes Conception,,BUT Génie Civil – Construction Durable  Bureau d’Etudes Conception
BUT,Métiers de la Transition et de l'Efficacité Energétiques,Optimisation énergétique pour le bâtiment et l’industrie,,BUT Métiers de la Transition et de l'Efficacité Energétiques  Optimisation énergétique pour le bâtiment et l’industrie
BUT,Métiers de la Transition et de l'Efficacité Energétique,Réalisation des installations énergétiques pour le bâtiment et l’industrie,,BUT Métiers de la Transition et de l'Efficacité Energétique Réalisation des installations énergétiques pour le bâtiment et l’industrie
BUT,Métiers de la Transition et de l'Efficacité Energétiques,Management de l’énergie pour le bâtiment et l’industrie,,BUT Métiers de la Transition et de l'Efficacité Energétiques  Management de l’énergie pour le bâtiment et l’industrie
BUT,Métiers de la Transition et de l'Efficacité Energétiques,Exploitation des installations énergétiques pour le bâtiment et l’industrie,,BUT Métiers de la Transition et de l'Efficacité Energétiques  Exploitation des installations énergétiques pour le bâtiment et l’industrie
BUT,Carrières Juridiques,Administration et Justice,,BUT Carrières Juridiques  Administration et Justice
BUT,Carrières Juridiques,Patrimoine et Finance,,BUT Carrières Juridiques  Patrimoine et Finance
BUT,Carrières Juridiques,Associations et Entreprises,,BUT Carrières Juridiques  Associations et Entreprises
BUT,Chimie,Contôle qualité,,BUT Chimie  Contôle qualité
BUT,Chimie,Synthèse,,BUT Chimie  Synthèse
BUT,Chimie,Matériaux et produits formulés,,BUT Chimie  Matériaux et produits formulés
BUT,Chimie,Chimie industrielle,,BUT Chimie  Chimie industrielle
BUT,Génie Industriel et Maintenance,Ingénierie des Systèmes Pluritechniques,,BUT Génie Industriel et Maintenance  Ingénierie des Systèmes Pluritechniques
BUT,Génie Industriel et Maintenance,"Management, Méthodes et Maintenance Innovante",,"BUT Génie Industriel et Maintenance Management, Méthodes et Maintenance Innovante"
BUT,Métiers du Multimédia et de l’Internet,Stratégie de communication numérique et design d’expérience,,BUT Métiers du Multimédia et de l’Internet  Stratégie de communication numérique et design d’expérience
BUT,Métiers du Multimédia et de l’Internet,Création numérique,,BUT Métiers du Multimédia et de l’Internet  Création numérique
BUT,Métiers du Multimédia et de l’Internet,Développement web et dispositifs interactifs,Developpement informatique,BUT Métiers du Multimédia et de l’Internet  Développement web et dispositifs interactifs
BUT,Réseaux & Télécommunications,Développement système et Cloud,,BUT Réseaux & Télécommunications  Développement système et Cloud
BUT,Carrières Sociales,Animation Sociale et Socioculturelle,,BUT Carrières Sociales  Animation Sociale et Socioculturelle
BUT,Carrières Sociales,Coordination et Gestion des Établissements et Services Sanitaires et Sociaux,,BUT Carrières Sociales  Coordination et Gestion des Établissements et Services Sanitaires et Sociaux
BUT,Carrières Sociales,Education Spécialisée,,BUT Carrières Sociales  Education Spécialisée
BUT,Carrières Sociales,Assistance Sociale,,BUT Carrières Sociales  Assistance Sociale
BUT,Carrières Sociales,Villes et territoires durables,,BUT Carrières Sociales  Villes et territoires durables
Licence Professionnelle,Acoustique et vibrations,,,Licence Professionnelle Acoustique et vibrations
Licence Professionnelle,Commercialisation de produits et services,,,Licence Professionnelle Commercialisation de produits et services
Licence Professionnelle,"Aménagement paysager : conception, gestion, entretien ",,,"Licence Professionnelle Aménagement paysager : conception, gestion, entretien  "
Licence Professionnelle,Commerce et distribution,,,Licence Professionnelle Commerce et distribution
Licence Professionnelle,Métiers de la gestion et de la comptabilité : comptabilité et gestion des entités agricoles,,,Licence Professionnelle Métiers de la gestion et de la comptabilité : comptabilité et gestion des entités agricoles
Licence Professionnelle,Services à la personne (fiche nationale),,,Licence Professionnelle Services à la personne (fiche nationale)
Licence Professionnelle,"Agriculture biologique : production, conseil, certification et commercialisation (",,,"Licence Professionnelle Agriculture biologique : production, conseil, certification et commercialisation ( "
Licence Professionnelle,Gestion des organisations agricoles et agroalimentaires,,,Licence Professionnelle Gestion des organisations agricoles et agroalimentaires
Licence Professionnelle,Métiers de la gestion et de la comptabilité,contrôle de gestion,,Licence Professionnelle Métiers de la gestion et de la comptabilité  contrôle de gestion
Licence Professionnelle,Métiers de la gestion et de la comptabilité,gestion comptable et financière,,Licence Professionnelle Métiers de la gestion et de la comptabilité  gestion comptable et financière
Licence Professionnelle,Métiers de la médiation par des approches artistiques et culturelles,,,Licence Professionnelle Métiers de la médiation par des approches artistiques et culturelles
Licence Professionnelle,Métiers de l'immobilier : gestion et développement de patrimoine immobilier,,,Licence Professionnelle Métiers de l'immobilier : gestion et développement de patrimoine immobilier
Licence Professionnelle,Métiers de la gestion et de la comptabilité,révision comptable,,Licence Professionnelle Métiers de la gestion et de la comptabilité  révision comptable
Licence Professionnelle,Techniques du vide et des matériaux,,,Licence Professionnelle Techniques du vide et des matériaux
Licence Professionnelle,Domotique,,,Licence Professionnelle Domotique
Licence Professionnelle,Métiers de l'industrie : industrie navale et maritime,,,Licence Professionnelle Métiers de l'industrie : industrie navale et maritime
Licence Professionnelle,Métiers de la GRH,"formation, compétences et emploi ",,"Licence Professionnelle Métiers de la GRH  formation, compétences et emploi "
Licence Professionnelle,Métiers de la GRH,,,Licence Professionnelle Métiers de la GRH
Licence Professionnelle,Activités juridiques : métiers du droit des transports,,,Licence Professionnelle Activités juridiques : métiers du droit des transports
Licence Professionnelle,"Cartographie, topographie et systèmes d'information géographique ",,,"Licence Professionnelle Cartographie, topographie et systèmes d'information géographique  "
Licence Professionnelle,"Métiers de l’électronique : communication, systèmes embarqués ",,,"Licence Professionnelle Métiers de l’électronique : communication, systèmes embarqués  "
Licence Professionnelle,Métiers de l'informatique,administration et sécurité des systèmes et des réseaux,,Licence Professionnelle Métiers de l'informatique  administration et sécurité des systèmes et des réseaux
Licence Professionnelle,Métiers de l'informatique,applications web,,Licence Professionnelle Métiers de l'informatique applications web
Licence Professionnelle,Métiers de l'informatique,"conception, développement et tests de logiciels ",,"Licence Professionnelle Métiers de l'informatique  conception, développement et tests de logiciels "
Licence Professionnelle,Métiers de l'informatique,conduite de projets,,Licence Professionnelle Métiers de l'informatique  conduite de projets
Licence Professionnelle,Métiers des réseaux informatiques et télécommunications,,,Licence Professionnelle Métiers des réseaux informatiques et télécommunications
Licence Professionnelle,Métiers du décisionnel et de la statistique,,,Licence Professionnelle Métiers du décisionnel et de la statistique
Licence Professionnelle,Métiers du jeu vidéo,,,Licence Professionnelle Métiers du jeu vidéo
Licence Professionnelle,"Métiers du numérique : conception, rédaction et réalisation web ",,,"Licence Professionnelle Métiers du numérique : conception, rédaction et réalisation web  "
Licence Professionnelle,"Systèmes automatisés, réseaux et informatique industrielle ",,,"Licence Professionnelle Systèmes automatisés, réseaux et informatique industrielle  "
Licence Professionnelle,Métiers de l'informatique,systèmes d'information et gestion des bases de données,,Licence Professionnelle Métiers de l'informatique  systèmes d'information et gestion des bases de données
Licence Professionnelle,Guide conférencier,,,Licence Professionnelle Guide conférencier
Licence Professionnelle,Métiers des arts culinaires et des arts de la table,,,Licence Professionnelle Métiers des arts culinaires et des arts de la table
Licence Professionnelle,Métiers du tourisme,commercialisation des produits touristiques,,Licence Professionnelle Métiers du tourisme commercialisation des produits touristiques
Licence Professionnelle,Métiers du tourisme,communication et valorisation des territoires,,Licence Professionnelle Métiers du tourisme  communication et valorisation des territoires
Licence Professionnelle,Métiers du tourisme et des loisirs (fiche nationale),,,Licence Professionnelle Métiers du tourisme et des loisirs (fiche nationale)
Licence Professionnelle,Organisation et gestion des établissements hôteliers et de restauration,,,Licence Professionnelle Organisation et gestion des établissements hôteliers et de restauration
Licence Professionnelle,Protection et valorisation du patrimoine historique et culturel,,,Licence Professionnelle Protection et valorisation du patrimoine historique et culturel
Licence Professionnelle,Logistique et pilotage des flux,,,Licence Professionnelle Logistique et pilotage des flux
Licence Professionnelle,Logistique et systèmes d’information,,,Licence Professionnelle Logistique et systèmes d’information
Licence Professionnelle,Logistique et transports internationaux,,,Licence Professionnelle Logistique et transports internationaux
Licence Professionnelle,Management des transports et de la distribution,,,Licence Professionnelle Management des transports et de la distribution
Licence Professionnelle,Management des processus logistiques,,,Licence Professionnelle Management des processus logistiques
Licence Professionnelle,Activités juridiques,Assistant juridique,,Licence Professionnelle Activités juridiques  Assistant juridique
Licence Professionnelle,Activités juridiques,contentieux et recouvrement,,Licence Professionnelle Activités juridiques  contentieux et recouvrement
Licence Professionnelle,Activités juridiques,métiers du droit de l'immobilier,,Licence Professionnelle Activités juridiques métiers du droit de l'immobilier
Licence Professionnelle,Activités juridiques,métiers du droit privé,,Licence Professionnelle Activités juridiques  métiers du droit privé
Licence Professionnelle,Activités juridiques,métiers du droit social,,Licence Professionnelle Activités juridiques  métiers du droit social
Licence Professionnelle,Agencement,,,Licence Professionnelle Agencement
Licence Professionnelle,Agent de recherches privées,,,Licence Professionnelle Agent de recherches privées
Licence Professionnelle,Agronomie,,,Licence Professionnelle Agronomie
Licence Professionnelle,"Analyse, qualité et contrôle des matériaux produits ",,,"Licence Professionnelle Analyse, qualité et contrôle des matériaux produits  "
Licence Professionnelle,Analyste criminel opérationnel,,,Licence Professionnelle Analyste criminel opérationnel
Licence Professionnelle,Bio-industries et biotechnologies,,,Licence Professionnelle Bio-industries et biotechnologies
Licence Professionnelle,Biologie analytique et expérimentale,,,Licence Professionnelle Biologie analytique et expérimentale
Licence Professionnelle,Bois et ameublement,,,Licence Professionnelle Bois et ameublement
Licence Professionnelle,Chimie : formulation,,,Licence Professionnelle Chimie : formulation
Licence Professionnelle,"Chimie analytique, contrôle, qualité, environnement ",,,"Licence Professionnelle Chimie analytique, contrôle, qualité, environnement  "
Licence Professionnelle,Chimie de synthèse,,,Licence Professionnelle Chimie de synthèse
Licence Professionnelle,Chimie et physique des matériaux,,,Licence Professionnelle Chimie et physique des matériaux
Licence Professionnelle,Chimie industrielle,,,Licence Professionnelle Chimie industrielle
Licence Professionnelle,Commercialisation des produits alimentaires,,,Licence Professionnelle Commercialisation des produits alimentaires
Licence Professionnelle,Communication et valorisation de la création artistique,,,Licence Professionnelle Communication et valorisation de la création artistique
Licence Professionnelle,Conception et contrôle des procédés,,,Licence Professionnelle Conception et contrôle des procédés
Licence Professionnelle,Coopération et développement international,,,Licence Professionnelle Coopération et développement international
Licence Professionnelle,Développement de projets de territoires,,,Licence Professionnelle Développement de projets de territoires
Licence Professionnelle,E-commerce et marketing numérique,,,Licence Professionnelle E-commerce et marketing numérique
Licence Professionnelle,Exploration et exploitation pétrolières,,,Licence Professionnelle Exploration et exploitation pétrolières
Licence Professionnelle,Génie des procédés et bio procédés industriels,,,Licence Professionnelle Génie des procédés et bio procédés industriels
Licence Professionnelle,Génie des procédés pour l'environnement,,,Licence Professionnelle Génie des procédés pour l'environnement
Licence Professionnelle,Gestion de projets et structures artistiques et culturels,,,Licence Professionnelle Gestion de projets et structures artistiques et culturels
Licence Professionnelle,Gestion des achats et des approvisionnements,,,Licence Professionnelle Gestion des achats et des approvisionnements
Licence Professionnelle,Gestion des organisations de l'économie sociale et solidaire,,,Licence Professionnelle Gestion des organisations de l'économie sociale et solidaire
Licence Professionnelle,Gestion des risques industriels et technologiques,,,Licence Professionnelle Gestion des risques industriels et technologiques
Licence Professionnelle,Gestion des structures sanitaires et sociales,,,Licence Professionnelle Gestion des structures sanitaires et sociales
Licence Professionnelle,Gestion et accompagnement de projets pédagogiques,,,Licence Professionnelle Gestion et accompagnement de projets pédagogiques
Licence Professionnelle,Gestion et maintenance des installations énergétiques,,,Licence Professionnelle Gestion et maintenance des installations énergétiques
Licence Professionnelle,"Industries agroalimentaires : gestion, production et valorisation ",,,"Licence Professionnelle Industries agroalimentaires : gestion, production et valorisation  "
Licence Professionnelle,"Industries pharmaceutiques, cosmétologiques et de santé : gestion, production et valorisation ",,,"Licence Professionnelle Industries pharmaceutiques, cosmétologiques et de santé : gestion, production et valorisation  "
Licence Professionnelle,Installations frigorifiques et de conditionnement d'air,,,Licence Professionnelle Installations frigorifiques et de conditionnement d'air
Licence Professionnelle,Intervention sociale,accompagnement de publics spécifiques,,Licence Professionnelle Intervention sociale accompagnement de publics spécifiques
Licence Professionnelle,Intervention sociale,accompagnement social,,Licence Professionnelle Intervention sociale accompagnement social
Licence Professionnelle,Intervention sociale,insertion et réinsertion sociale et professionnelle,,Licence Professionnelle Intervention sociale insertion et réinsertion sociale et professionnelle
Licence Professionnelle,Management et gestion des organisations,,,Licence Professionnelle Management et gestion des organisations
Licence Professionnelle,Métiers de la protection et de la gestion de l'environnement,,,Licence Professionnelle Métiers de la protection et de la gestion de l'environnement
Licence Professionnelle,"Maintenance des systèmes industriels, de production et d'énergie ",,,"Licence Professionnelle Maintenance des systèmes industriels, de production et d'énergie  "
Licence Professionnelle,Maintenance et technologie,contrôle industriel,,Licence Professionnelle Maintenance et technologie  contrôle industriel
Licence Professionnelle,Maintenance et technologie,"électronique, instrumentation",,"Licence Professionnelle Maintenance et technologie  électronique, instrumentation"
Licence Professionnelle,Maintenance et technologie,organisation de la maintenance,,Licence Professionnelle Maintenance et technologie  organisation de la maintenance
Licence Professionnelle,Maintenance et technologie,systèmes pluritechniques,,Licence Professionnelle Maintenance et technologie  systèmes pluritechniques
Licence Professionnelle,Maintenance et technologie,technologie médicale et biomédicale,,Licence Professionnelle Maintenance et technologie  technologie médicale et biomédicale
Licence Professionnelle,"Maîtrise de l'énergie, électricité, développement durable ",,,"Licence Professionnelle Maîtrise de l'énergie, électricité, développement durable  "
Licence Professionnelle,Management des activités commerciales,,,Licence Professionnelle Management des activités commerciales
Licence Professionnelle,Métiers de la promotion des produits de santé,,,Licence Professionnelle Métiers de la promotion des produits de santé
Licence Professionnelle,"Qualité, hygiène, sécurité, santé, environnement ",,,"Licence Professionnelle Qualité, hygiène, sécurité, santé, environnement  "
Licence Professionnelle,Matériaux et structures,fonctionnalisation et traitements des surfaces,,Licence Professionnelle Matériaux et structures  fonctionnalisation et traitements des surfaces
Licence Professionnelle,Matériaux et structures,"gestion, conception et industrialisation",,"Licence Professionnelle Matériaux et structures  gestion, conception et industrialisation"
Licence Professionnelle,Métiers de la communication,chargé de communication,,Licence Professionnelle Métiers de la communication chargé de communication
Licence Professionnelle,Métiers de la communication,chef de projet communication,,Licence Professionnelle Métiers de la communication chef de projet communication
Licence Professionnelle,Métiers de la communication,événementiel,,Licence Professionnelle Métiers de la communication  événementiel
Licence Professionnelle,Métiers de la gestion et de la comptabilité,comptabilité et gestion des associations,,Licence Professionnelle Métiers de la gestion et de la comptabilité comptabilité et gestion des associations
Licence Professionnelle,Métiers de la gestion et de la comptabilité,comptabilité et paie,,Licence Professionnelle Métiers de la gestion et de la comptabilité  comptabilité et paie
Licence Professionnelle,Métiers de la gestion et de la comptabilité, fiscalité,,Licence Professionnelle Métiers de la gestion et de la comptabilité   fiscalité
Licence Professionnelle,Métiers de la gestion et de la comptabilité,responsable de portefeuille clients en cabinet d'expertise,,Licence Professionnelle Métiers de la gestion et de la comptabilité responsable de portefeuille clients en cabinet d'expertise
Licence Professionnelle,Métiers de la médiation scientifique et technique,,,Licence Professionnelle Métiers de la médiation scientifique et technique
Licence Professionnelle,Métiers de la mode,,,Licence Professionnelle Métiers de la mode
Licence Professionnelle,Métiers de la qualité,,,Licence Professionnelle Métiers de la qualité
Licence Professionnelle,Métiers de la radioprotection et de la sécurité nucléaire,,,Licence Professionnelle Métiers de la radioprotection et de la sécurité nucléaire
Licence Professionnelle,Métiers de la santé,"nutrition, alimentation",,"Licence Professionnelle Métiers de la santé  nutrition, alimentation"
Licence Professionnelle,Métiers de la santé,technologies,,Licence Professionnelle Métiers de la santé  technologies
