degree,formation,speciality,segmentation,
BACHELOR,Santé,Diététique,,BACHELOR Santé Diététique
BACHELOR,Santé,Marketing de la santé,,BACHELOR Santé  Marketing de la santé
BACHELOR,Sciences politiques,,,BACHELOR Sciences politiques
BACHELOR,Secrétariat,,,BACHELOR Secrétariat
BACHELOR,Sécurité prévention,HSE,,BACHELOR Sécurité prévention HSE
BACHELOR,Sécurité prévention,QSE,,BACHELOR Sécurité prévention QSE
BACHELOR,Services à la personne,,,BACHELOR Services à la personne
BACHELOR,Social,,,BACHELOR Social
BACHELOR,Sport,eSport,,BACHELOR Sport  eSport
BACHELOR,Sport,Management du sport,,BACHELOR Sport  Management du sport
BACHELOR,Sport,Marketing sportif,,BACHELOR Sport  Marketing sportif
BACHELOR,Sport,Sport business,,BACHELOR Sport  Sport business
BACHELOR,Stratégie,Stratégie d entreprise,,BACHELOR Stratégie Stratégie d entreprise
BACHELOR,Système d'information,Big data,,BACHELOR Système d'information  Big data
BACHELOR,Système d'information,Data science,,BACHELOR Système d'information Data science
BACHELOR,Système d'information,Management des SI,,BACHELOR Système d'information Management des SI
BACHELOR,Systèmes et réseaux,Cybersécurité,,BACHELOR Systèmes et réseaux Cybersécurité
BACHELOR,Systèmes et réseaux,Management des SI,,BACHELOR Systèmes et réseaux Management des SI
BACHELOR,Systèmes et réseaux,Sécurité informatique,,BACHELOR Systèmes et réseaux Sécurité informatique
BACHELOR,Systèmes et réseaux,Systèmes numériques,,BACHELOR Systèmes et réseaux  Systèmes numériques
BACHELOR,Technologies de l'information,Data science,,BACHELOR Technologies de l'information Data science
BACHELOR,Technologies de l'information,Big Data,,BACHELOR Technologies de l'information Big Data
BACHELOR,Télécommunication,Systèmes embarqués,,BACHELOR Télécommunication Systèmes embarqués
BACHELOR,Tourisme,Hospitality management,,BACHELOR Tourisme Hospitality management
BACHELOR,Tourisme,Management du tourisme,,BACHELOR Tourisme  Management du tourisme
BACHELOR,Transport,,,BACHELOR Transport
BACHELOR,Travail social,,,BACHELOR Travail social
BACHELOR,Vente,e-business,,BACHELOR Vente  e-business
BACHELOR,Vente,e-commerce,,BACHELOR Vente  e-commerce
BACHELOR,Vente,TC,,BACHELOR Vente  TC
BACHELOR,Web Design,Création de site Internet,,BACHELOR Web Design  Création de site Internet
BACHELOR,Web Design,UX Design,,BACHELOR Web Design  UX Design
MS,Achat,Stratégie d' entreprise,,MS Achat  Stratégie d' entreprise
MS,Administration des entreprises,,,MS Administration des entreprises
MS,Analyse financière,,,MS Analyse financière
MS,Art graphique,,,MS Art graphique
MS,Art textile,,,MS Art textile
MS,Assurance,PAB,,MS Assurance PAB
MS,Audit,,,MS Audit
MS,Banque,PAB,,MS Banque  PAB
MS,Banque,Gestion du patrimoine,,MS Banque  Gestion du patrimoine
MS,Bâtiment et Travaux Publics,,,MS Bâtiment et Travaux Publics
MS,Commerce,,,MS Commerce
MS,Commerce,e-business,,MS Commerce  e-business
MS,Commerce,e-commerce,,MS Commerce e-commerce
MS,Commerce,Ingénieur d'affaire,,MS Commerce Ingénieur d'affaire
MS,Commerce,International Business,,MS Commerce International Business
MS,Commerce,Management international,,MS Commerce Management international
MS,Commerce,Marketing International,,MS Commerce Marketing International
MS,Commerce,Stratégie d'entreprise,,MS Commerce Stratégie d'entreprise
MS,Commerce international,International Business,,MS Commerce international  International Business
MS,Commerce international,Management international,,MS Commerce international  Management international
MS,Commerce international,Marketing International,,MS Commerce international  Marketing International
MS,Communication,Communication d'entreprise,,MS Communication Communication d'entreprise
MS,Communication,Communication digitale,,MS Communication Communication digitale
MS,Communication,Communication Evénementiel,,MS Communication Communication Evénementiel
MS,Communication,Marketing Digital,,MS Communication Marketing Digital
MS,Communication,Web Marketing,,MS Communication Web Marketing
MS,Comptabilité,,,MS Comptabilité
MS,Contrôle de gestion,,,MS Contrôle de gestion
MS,Développement durable,Management de l'environnement,,MS Développement durable Management de l'environnement
MS,Développement durable,Sustainable Development,,MS Développement durable Sustainable Development
MS,Digital,Communication digitale,,MS Digital  Communication digitale
MS,Digital,Digital management,,MS Digital  Digital management
MS,Digital,Management de l'innovation,,MS Digital  Management de l'innovation
MS,Droit,,,MS Droit
MS,Droit international,,,MS Droit international
MS,Droit privé,,,MS Droit privé
MS,Droit public,,,MS Droit public
MS,Droit social,,,MS Droit social
MS,Economie,,,MS Economie
MS,Entrepreneuriat,,,MS Entrepreneuriat
MS,Environnement,Management de l'environnement,,MS Environnement  Management de l'environnement
MS,Environnement,QSE,,MS Environnement  QSE
MS,Environnement,Sustainable Development,,MS Environnement  Sustainable Development
MS,Evénementiel,Communication Evénementiel,,MS Evénementiel Communication Evénementiel
MS,Evénementiel,Management Evénementiel,,MS Evénementiel Management Evénementiel
MS,Finance,Corporate Finance,,MS Finance  Corporate Finance
MS,Finance,Finance d'entreprise,,MS Finance  Finance d'entreprise
MS,Finance,Finance des marchés,,MS Finance  Finance des marchés
MS,Finance,Gestion des risques,,MS Finance  Gestion des risques
MS,Fiscalité,,,MS Fiscalité
MS,Génie civil,,,MS Génie civil
MS,Génie industriel,,,MS Génie industriel
MS,Gestion,Gestion du patrimoine,,MS Gestion  Gestion du patrimoine
MS,Gestion,PAB,,MS Gestion  PAB
MS,Gestion,Stratégie d'entreprise,,MS Gestion  Stratégie d'entreprise
MS,Graphisme,,,MS Graphisme
MS,Hôtellerie,,,MS Hôtellerie
MS,Immobilier,Gestion du patrimoine,,MS Immobilier  Gestion du patrimoine
MS,Immobilier,PAB,,MS Immobilier  PAB
MS,Industrie,,,MS Industrie
MS,Infographie 3D,,,MS Infographie 3D
MS,Informatique,Big data,informatique,MS Informatique  Big data
MS,Informatique,Management des SI,,MS Informatique  Management des SI
MS,Informatique,Protection des données personnelles,,MS Informatique  Protection des données personnelles
MS,Informatique,Sécurité informatique,,MS Informatique  Sécurité informatique
MS,Informatique,Systèmes numériques,,MS Informatique  Systèmes numériques
MS,Ingénieur,Ingénieur d affaire,,MS Ingénieur Ingénieur d affaire
MS,Internet,Communication digitale,communication,MS Internet  Communication digitale
MS,Internet,Digital management,,MS Internet  Digital management
MS,Internet,e-business,,MS Internet  e-business
MS,Internet,e-commerce,,MS Internet  e-commerce
MS,Internet,Marketing Digital,,MS Internet  Marketing Digital
MS,Internet,Web,,MS Internet  Web
MS,Internet,Web Marketing,,MS Internet  Web Marketing
MS,Internet,Web Mobile,,MS Internet  Web Mobile
MS,Jeux Vidéo,,,MS Jeux Vidéo
MS,Juridique,,,MS Juridique
MS,Logistique,Supply Chain,,MS Logistique  Supply Chain
MS,Luxe,Management du luxe,management,MS Luxe  Management du luxe
MS,Maintenance - qualité,QSE,,MS Maintenance - qualité QSE
MS,Maintenance informatique,Sécurité informatique,informatique,MS Maintenance informatique Sécurité informatique
MS,Management,Communication Evénementiel,,MS Management  Communication Evénementiel
MS,Management,Digital management,,MS Management  Digital management
MS,Management,Management de l'environnement,,MS Management  Management de l'environnement
MS,Management,Management de l'innovation,,MS Management  Management de l'innovation
MS,Management,Management de la santé,,MS Management  Management de la santé
MS,Management,Management de projet,,MS Management  Management de projet
MS,Management,Management des SI,,MS Management  Management des SI
MS,Management,Management du sport,,MS Management  Management du sport
MS,Management,Management Evénementiel,,MS Management  Management Evénementiel
MS,Management,Management international,,MS Management  Management international
MS,Management,Marketing sportif,,MS Management  Marketing sportif
MS,Management,Sport business,,MS Management  Sport business
MS,Management,Stratégie d'entreprise,,MS Management  Stratégie d'entreprise
MS,Management,Supply chain,,MS Management  Supply chain
MS,Management,Sustainable Development,,MS Management  Sustainable Development
MS,Marketing,Etudes et décisions marketing,,MS Marketing Etudes et décisions marketing
MS,Marketing,Marketing Digital,,MS Marketing Marketing Digital
MS,Marketing,Marketing International,,MS Marketing Marketing International
MS,Marketing,Marketing sportif,,MS Marketing Marketing sportif
MS,Marketing,Web Marketing,,MS Marketing Web Marketing
MS,Médias,,,MS Médias
MS,Mode,Management de luxe,,MS Mode Management de luxe
MS,Motion design,,,MS Motion design
MS,Multimédia,Web,,MS Multimédia  Web
MS,Multimédia,Communication digitale,,MS Multimédia  Communication digitale
MS,Négociation,,,MS Négociation
MS,Publicité,Communication digitale,,MS Publicité Communication digitale
MS,Publicité,Marketing Digital,,MS Publicité Marketing Digital
MS,Publicité,Web Marketing,,MS Publicité Web Marketing
MS,Ressources humaines,,,MS Ressources humaines
MS,Santé,Management de la santé,,MS Santé  Management de la santé
MS,Sécurité prévention,QSE,,MS Sécurité prévention QSE
MS,Sport,Management du sport,,MS Sport Management du sport
MS,Sport,Marketing sportif,,MS Sport Marketing sportif
MS,Sport,Sport business,,MS Sport Sport business
MS,Stratégie,Intelligence économique,,MS Stratégie  Intelligence économique
MS,Stratégie,Stratégie d'entreprise,,MS Stratégie  Stratégie d'entreprise
MS,Stratégie,Conseil et Stratégie,,MS Stratégie  Conseil et Stratégie
MS,Système d'information,Big data,,MS Système d'information Big data
MS,Système d'information,Management des SI,,MS Système d'information Management des SI
MS,Systèmes et réseaux,Management des SI,,MS Systèmes et réseaux  Management des SI
MS,Systèmes et réseaux,Sécurité informatique,,MS Systèmes et réseaux  Sécurité informatique
MS,Technologies de l'information,Big data,,MS Technologies de l'information Big data
MS,Télécommunication,,,MS Télécommunication
MS,Tourisme,,,MS Tourisme
MS,Vente,E-Business,,MS Vente  E-Business
MS,Vente,E-Commerce,,MS Vente  E-Commerce
MS,Web Design,,,MS Web Design
MBA,Achat,Supply Chain,,MBA Achat Supply Chain
MBA,Administration des entreprises,,,MBA Administration des entreprises
MBA,Agroalimentaire,,,MBA Agroalimentaire
MBA,Analyse financière,,,MBA Analyse financière
MBA,Art,Communication visuelle,,MBA Art Communication visuelle
MBA,Art appliqué,Communication visuelle,,MBA Art appliqué Communication visuelle
MBA,Art graphique,,,MBA Art graphique
MBA,Art textile,Stylisme,,MBA Art textile Stylisme
MBA,Assurance,,,MBA Assurance
MBA,Audit,,,MBA Audit
MBA,Banque,Gestion du patrimoine,,MBA Banque Gestion du patrimoine
MBA,Bien-être,,,MBA Bien-être
MBA,Commerce,Digital management,,MBA Commerce Digital management
MBA,Commerce,e-business,,MBA Commerce e-business
MBA,Commerce,e-commerce,,MBA Commerce e-commerce
MBA,Commerce,International Business,,MBA Commerce International Business
MBA,Commerce,Management international,,MBA Commerce Management international
MBA,Commerce,Marketing International,,MBA Commerce Marketing International
MBA,Commerce,Stratégie d'entreprise,,MBA Commerce Stratégie d'entreprise
MBA,Commerce international,International Business,,MBA Commerce international International Business
MBA,Commerce international,Management international,,MBA Commerce international Management international
MBA,Commerce international,Marketing International,,MBA Commerce international Marketing International
MBA,Communication,Communication digitale,,MBA Communication Communication digitale
MBA,Communication,Communication Evénementiel,,MBA Communication Communication Evénementiel
MBA,Communication,Marketing Digital,,MBA Communication Marketing Digital
MBA,Communication,Web Marketing,,MBA Communication Web Marketing
MBA,Comptabilité,,,MBA Comptabilité
MBA,Contrôle de gestion,,,MBA Contrôle de gestion
MBA,Culture,,,MBA Culture
MBA,Design,UX Design,,MBA Design UX Design
MBA,Dessin,,,MBA Dessin
MBA,Développement durable,Sustainable Development,,MBA Développement durable Sustainable Development
MBA,Digital,Communication digitale,,MBA Digital  Communication digitale
MBA,Digital,Digital management,,MBA Digital  Digital management
MBA,Digital,Management de l'innovation,,MBA Digital  Management de l'innovation
MBA,Digital,Marketing Digital,,MBA Digital  Marketing Digital
MBA,Droit,,,MBA Droit
MBA,Droit international,,,MBA Droit international
MBA,Droit privé,,,MBA Droit privé
MBA,Droit public,,,MBA Droit public
MBA,Droit social,,,MBA Droit social
MBA,Economie,,,MBA Economie
MBA,Entrepreneuriat,,,MBA Entrepreneuriat
MBA,Environnement,Sustainable Development,,MBA Environnement Sustainable Development
MBA,Evénementiel,Communication Evénementiel,,MBA Evénementiel Communication Evénementiel
MBA,Evénementiel,Management Evénementiel,,MBA Evénementiel Management Evénementiel
MBA,Executive MBA,,,MBA Executive MBA
MBA,Finance,Corporate Finance,,MBA Finance Corporate Finance
MBA,Finance,Finance d'entreprise,,MBA Finance Finance d'entreprise
MBA,Finance,Finance des marchés,,MBA Finance Finance des marchés
MBA,Finance,Management financier,,MBA Finance Management financier
MBA,Gestion,Gestion de projet,,MBA Gestion  Gestion de projet
MBA,Gestion,Gestion des entreprises,,MBA Gestion  Gestion des entreprises
MBA,Gestion,GRH,,MBA Gestion  GRH
MBA,Gestion,Gestion du patrimoine,,MBA Gestion  Gestion du patrimoine
MBA,Gestion,Stratégie d'entreprise,,MBA Gestion  Stratégie d'entreprise
MBA,Global MBA,,,MBA Global MBA
MBA,Graphisme,Communication visuelle,,MBA Graphisme Communication visuelle
MBA,Graphisme,UX Design,,MBA Graphisme UX Design
MBA,Hôtellerie,Hospitality management,,MBA Hôtellerie Hospitality management
MBA,Hôtellerie,MHR,,MBA Hôtellerie MHR
MBA,Hôtellerie,Management hôtelier,,MBA Hôtellerie Management hôtelier
MBA,Immobilier,Gestion du patrimoine,,MBA Immobilier Gestion du patrimoine
MBA,Industrie,,,MBA Industrie
MBA,Infographie,,,MBA Infographie
MBA,Infographie 3D,,,MBA Infographie 3D
MBA,Informatique,Big data,,MBA Informatique  Big data
MBA,Informatique,Cybersécurité,,MBA Informatique  Cybersécurité
MBA,Informatique,Data science,,MBA Informatique  Data science
MBA,Informatique,Développement logiciel,,MBA Informatique  Développement logiciel
MBA,Informatique,Intelligence artificielle,,MBA Informatique  Intelligence artificielle
MBA,Informatique,Sécurité informatique,,MBA Informatique  Sécurité informatique
MBA,Ingénieur,,,MBA Ingénieur
MBA,International MBA,,,MBA International MBA
MBA,Internet,Communication digitale,,MBA Internet  Communication digitale
MBA,Internet,Cybersécurité,,MBA Internet  Cybersécurité
MBA,Internet,Digital management,,MBA Internet  Digital management
MBA,Internet,e-business,,MBA Internet  e-business
MBA,Internet,e-commerce,,MBA Internet  e-commerce
MBA,Internet,Marketing Digital,,MBA Internet  Marketing Digital
MBA,Internet,Web,,MBA Internet  Web
MBA,Internet,Web Marketing,,MBA Internet  Web Marketing
MBA,Juridique,,,MBA Juridique
MBA,Logistique,Supply chain,,MBA Logistique Supply chain
MBA,Luxe,Management du luxe,,MBA Luxe Management du luxe
MBA,Luxe,Marketing du Luxe,,MBA Luxe Marketing du Luxe
MBA,Maintenance - qualité,,,MBA Maintenance - qualité
MBA,Maintenance informatique,Cybersécurité,,MBA Maintenance informatique Cybersécurité
MBA,Maintenance informatique,Sécurité informatique,,MBA Maintenance informatique Sécurité informatique
MBA,Management,Communication Evénementiel,,MBA Management  Communication Evénementiel
MBA,Management,Digital management,,MBA Management  Digital management
MBA,Management,Gestion de projet,,MBA Management  Gestion de projet
MBA,Management,Gestion des entreprises,,MBA Management  Gestion des entreprises
MBA,Management,GRH,,MBA Management  GRH
MBA,Management,Management de l'innovation,,MBA Management  Management de l'innovation
MBA,Management,Management de projet,,MBA Management  Management de projet
MBA,Management,Management du sport,,MBA Management  Management du sport
MBA,Management,Management du vin,,MBA Management  Management du vin
MBA,Management,MHR,,MBA Management  MHR
MBA,Management,Management Evénementiel,,MBA Management  Management Evénementiel
MBA,Management,Management financier,,MBA Management  Management financier
MBA,Management,Management hôtelier,,MBA Management  Management hôtelier
MBA,Management,Management international,,MBA Management  Management international
MBA,Management,Marketing sportif,,MBA Management  Marketing sportif
MBA,Management,Sport business,,MBA Management  Sport business
MBA,Management,Stratégie d'entreprise,,MBA Management  Stratégie d'entreprise
MBA,Management,Supply chain,,MBA Management  Supply chain
MBA,Management,Sustainable Development,,MBA Management  Sustainable Development
MBA,Marketing,Marketing Digital,,MBA Marketing  Marketing Digital
MBA,Marketing,Marketing du Luxe,,MBA Marketing  Marketing du Luxe
MBA,Marketing,Marketing International,,MBA Marketing  Marketing International
MBA,Marketing,Marketing sportif,,MBA Marketing  Marketing sportif
MBA,Marketing,Web Marketing,,MBA Marketing  Web Marketing
MBA,Médias,,,MBA Médias
MBA,Mode,Management de la mode,,MBA Mode Management de la mode
MBA,Mode,Management du luxe,,MBA Mode Management du luxe
MBA,Mode,Merchandising,,MBA Mode Merchandising
MBA,Mode,Stylisme,,MBA Mode Stylisme
MBA,Motion design,,,MBA Motion design
MBA,Multimédia,Communication digitale,,MBA Multimédia Communication digitale
MBA,Multimédia,Web,,MBA Multimédia Web
MBA,Négociation,,,MBA Négociation
MBA,Oenologie,,,MBA Oenologie
MBA,Programmation informatique,,,MBA Programmation informatique
MBA,Publicité,Développement logiciel,,MBA Publicité Développement logiciel
MBA,Ressources humaines,GRH,,MBA Ressources humaines GRH
MBA,Restauration,,,MBA Restauration
MBA,Robotique,Intelligence artificielle,,MBA Robotique  Intelligence artificielle
MBA,Santé,,,MBA Santé
MBA,Sécurité prévention,,,MBA Sécurité prévention
MBA,Sport,Management du sport,,MBA Sport Management du sport
MBA,Sport,Marketing sportif,,MBA Sport Marketing sportif
MBA,Sport,Sport business,,MBA Sport Sport business
MBA,Stratégie,Intelligence économique,,MBA Stratégie  Intelligence économique
MBA,Stratégie,Stratégie d'entreprise,,MBA Stratégie  Stratégie d'entreprise
MBA,Stratégie,Conseil et Stratégie,,MBA Stratégie  Conseil et Stratégie
MBA,Système d'information,Big data,,MBA Système d'information  Big data
MBA,Système d'information,Data science,,MBA Système d'information  Data science
MBA,Systèmes et réseaux,Cybersécurité,,MBA Systèmes et réseaux  Cybersécurité
MBA,Systèmes et réseaux,Sécurité informatique,,MBA Systèmes et réseaux  Sécurité informatique
MBA,Technologies de l'information,Big data,,MBA Technologies de l'information Big data
MBA,Technologies de l'information,Data science,,MBA Technologies de l'information Data science
MBA,Tourisme,Hospitality management,,MBA Tourisme Hospitality management
MBA,Vente,e-business,,MBA Vente e-business
MBA,Vente,e-commerce,,MBA Vente e-commerce
MBA,Web Design,UX Design,,MBA Web Design  UX Design
DMA,Art,,,DMA Art
DMA,Art du spectacle,,,DMA Art du spectacle
DMA,Bijouterie,Art du bijou et du joyau,,DMA Bijouterie Art du bijou et du joyau
DMA,Décoration,,,DMA Décoration
DMA,Joaillerie,Art du bijou et du joyau,,DMA Joaillerie Art du bijou et du joyau
DEUST,Aménagement du territoire,,,DEUST Aménagement du territoire
DEUST,Bureautique,,,DEUST Bureautique
DEUST,Communication,,,DEUST Communication
DEUST,Digital,,,DEUST Digital
DEUST,Droit,,,DEUST Droit
DEUST,Droit international,,,DEUST Droit international
DEUST,Droit privé,,,DEUST Droit privé
DEUST,Droit public,,,DEUST Droit public
DEUST,Droit social,,,DEUST Droit social
DEUST,Gestion,,,DEUST Gestion
DEUST,Graphisme,,,DEUST Graphisme
DEUST,Informatique,,,DEUST Informatique
DEUST,Internet,,,DEUST Internet
DEUST,Juridique,,,DEUST Juridique
DEUST,Management,,,DEUST Management
DEUST,Médias,,,DEUST Médias
DEUST,Multimédia,,,DEUST Multimédia
DEUST,Notariat,,,DEUST Notariat
DEUST,Paramédical,,,DEUST Paramédical
DEUST,Pharmacie,,,DEUST Pharmacie
DEUST,Publicité,,,DEUST Publicité
DEUST,Santé,,,DEUST Santé
DEUST,Social,,,DEUST Social
Licence,Sciences et médecine,,,Licence Sciences et médecine
Licence,Psychologie,,,Licence Psychologie
Licence,Informatique,Cybersécurité,,Licence Informatique Cybersécurité
Licence,Informatique,MASS,,Licence Informatique MASS
Licence,Informatique,Math info,,Licence Informatique Math info
Licence,Informatique,MIAGE,,Licence Informatique MIAGE
Licence,Droit,LAP,,Licence Droit  LAP
Licence,Droit,Droit commercial,,Licence Droit  Droit commercial
Licence,Droit,Droit des affaires,,Licence Droit  Droit des affaires
Licence,Droit,Droit et économie,,Licence Droit  Droit et économie
Licence,Droit,Droit fiscal,,Licence Droit Droit fiscal
Licence,Economie et commerce,Droit et économie,,Licence Economie et commerce  Droit et économie
Licence,Economie et commerce,Économie et gestion,,Licence Economie et commerce  Économie et gestion
Licence,Economie et commerce,Intelligence économique,,Licence Economie et commerce  Intelligence économique
Licence,Information et communication,Marketing Digital,,Licence Information et communication  Marketing Digital
Licence,Achat,,,Licence Achat
Licence,Administration des entreprises,,,Licence Administration des entreprises
Licence,Agroalimentaire,,,Licence Agroalimentaire
Licence,Analyse financière,,,Licence Analyse financière
Licence,Art graphique,Animation 3D,,Licence Art graphique Animation 3D
Licence,Audit,,,Licence Audit
Licence,Automatisme,EEA,,Licence Automatisme EEA
Licence,Banque,,,Licence Banque
Licence,Biologie,Science du vivant,,Licence Biologie Science du vivant
Licence,Chimie,,,Licence Chimie
Licence,Commerce,Intelligence économique,,Licence Commerce Intelligence économique
Licence,Commerce,Management international,,Licence Commerce Management international
Licence,Commerce international,Management international,,Licence Commerce international Management international
Licence,Communication,Marketing digital,,Licence Communication Marketing digital
Licence,Comptabilité,,,Licence Comptabilité
Licence,Contrôle de gestion,,,Licence Contrôle de gestion
Licence,Développement durable,,,Licence Développement durable
Licence,Digital,,,Licence Digital
Licence,Droit,LAP,,Licence Droit  LAP
Licence,Droit,Droit commercial,,Licence Droit  Droit commercial
Licence,Droit,Droit des affaires,,Licence Droit  Droit des affaires
Licence,Droit,Droit et économie,,Licence Droit  Droit et économie
Licence,Droit international,Droit fiscal,,Licence Droit international Droit fiscal
Licence,Droit privé,,,Licence Droit privé
Licence,Droit public,,,Licence Droit public
Licence,Droit social,,,Licence Droit social
Licence,Economie,Droit et économie,,Licence Economie  Droit et économie
Licence,Economie,Économie et gestion,,Licence Economie  Économie et gestion
Licence,Economie,Intelligence économique,,Licence Economie  Intelligence économique
Licence,Electrique,,,Licence Electrique
Licence,Electronique,EEA,,Licence Electronique EEA
Licence,Electrotechnique,EEA,,Licence Electrotechnique EEA
Licence,Energie,,,Licence Energie
Licence,Entrepreneuriat,,,Licence Entrepreneuriat
Licence,Environnement,,,Licence Environnement
Licence,Finance,Finance d'entreprise,,Licence Finance Finance d'entreprise
Licence,Génie Civil,,,Licence Génie Civil
Licence,Gestion,Sciences de gestion,,Licence Gestion Sciences de gestion
Licence,Gestion,Économie et gestion,,Licence Gestion Économie et gestion
Licence,Gestion,Gestion des entreprises,,Licence Gestion Gestion des entreprises
Licence,Gestion,Intelligence économique,,Licence Gestion Intelligence économique
Licence,Graphisme,Animation 3D,,Licence Graphisme Animation 3D
Licence,Industrie,Industrie agroalimentaire,,Licence Industrie Industrie agroalimentaire
Licence,Infographie,,,Licence Infographie
Licence,Infographie 3D,Animation 3D,,Licence Infographie 3D Animation 3D
Licence,informatique,Cybersécurité,,Licence informatique  Cybersécurité
Licence,informatique,MASS,,Licence informatique  MASS
Licence,informatique,Math Info,,Licence informatique  Math Info
Licence,informatique,MIAGE,,Licence informatique  MIAGE
Licence,Informatique de gestion,MIAGE,,Licence Informatique de gestion MIAGE
Licence,Ingénieur,Industrie agroalimentaire,,Licence Ingénieur  Industrie agroalimentaire
Licence,Ingénieur,Science pour l'ingénieur,,Licence Ingénieur  Science pour l'ingénieur
Licence,Internet,Cybersécurité,,Licence Internet  Cybersécurité
Licence,Internet,Web,,Licence Internet Web
Licence,Jeux Vidéo,Animation 3D,,Licence Jeux Vidéo Animation 3D
Licence,Juridique,,,Licence Juridique
Licence,Logistique,,,Licence Logistique
Licence,Maintenance informatique,cybersécurité,,Licence Maintenance informatique cybersécurité
Licence,Management,Gestion des entreprises,,Licence Management  Gestion des entreprises
Licence,Management,Gestion du personnel,,Licence Management  Gestion du personnel
Licence,Management,Intelligence économique,,Licence Management  Intelligence économique
Licence,Management,Management international,,Licence Management  Management international
Licence,Marketing,Marketing Digital,,Licence Marketing  Marketing Digital
Licence,Mathématique,MASS,,Licence Mathématique MASS
Licence,Mathématique,Math Info,,Licence Mathématique Math Info
Licence,Mécanique,Génie mécanique,,Licence Mécanique Génie mécanique
Licence,Motion design,,,Licence Motion design
Licence,Multimédia,Web,,Licence Multimédia Web
Licence,Négociation,,,Licence Négociation
Licence,Physique,,,Licence Physique
